Varient_Name,Average_stars,Review_title,User_rating,Review_description
Royal Enfield Classic 350,4.2,Comes with Updated features - Classic 350,5,Royal Enfield Classic 350 gets two trip meters. The top-spec Chrome variant also comes with the company’s Tripper navigation display. It uses Google Maps data via your smartphone and solely displays navigation-related information. One of the most significant changes comes in the form of the ‘J-platform’ 349cc engine that replaces the 346cc UCE.
Royal Enfield Classic 350,4.2,Nice bike,4,"I think this would be a new revolution in RE bikes better than Benelli 400 AND JAWA 42, And more to come in 2020"
Royal Enfield Classic 350,4.2,Classic 350 - Equipped with new changes,4,"Royal Enfield Classic 350 has also made big changes to the chassis. For 2021, the basic single-cradle frame has been replaced by a double-downtube unit. This change is also similar to the one on the Meteor 350, with only the footpeg mounts being different. Its Looks and Colours are really awesome. Royal Enfield has said that this engine is the same as the one found on the Meteor 350. "
Royal Enfield Classic 350,4.2,This Bike Is Very Powerful,5,This bike is very powerful and I like this bike.
Royal Enfield Classic 350,4.2,New Classic 350 with superb performance,4,New Classic 350 with superb performance
Royal Enfield Classic 350,4.2,New Classic 350 - Comes with Extra Features,4,"Royal Enfield is always been my favorite brand in bikes, and the new classic 350 comes with some new features, which make it more powerful and stylish. Some variants come with tubeless tyres and alloy wheels. I really value this bike and going to purchase this soon."
Royal Enfield Classic 350,4.2,Little Expensive,4,"Royal Enfield Classic 350 motorcycle with a price tag ranging between Rs. 1.84 to Rs. 2.15 Lakh is a little expensive for the features that it is offering. It is available in 5 variants and 11 colours. Powered by a 349.34 cc bs6 engine, has a 5 Speed gearbox. It has Disc front brakes and Drum rear brakes along with ABS. I already have a classic 350 and I don't think it is worth the upgrade."
Royal Enfield Classic 350,4.2,Love This Bike,4,"Overall I love my bike, here are some facts about RE Classic 35, Comfortably rides without any back pain, has minimalist maintenance, has awesome features with safety measurements. "
Royal Enfield Classic 350,4.2,Mileage is not good- Royal enfield classic 350,3,"Royal enfield classic 350 is a dream bike for every men's, I am not having it but I rode 4-5 time, amazing moments of riding royal enfield classic 350. Mileage is 25-30 but if you buy 350cc bike then you not expect good mileage from bike. Classic 350 is a classic bike with 350 cc engine with single cylinder. After the launch of bs6 model more upgradation had been found in the vehicle. The new engine is fully refined and non-pollution."
Royal Enfield Classic 350,4.2,New Enfield Classic 350 Is Very Good Looking,4,"The new Royal Enfield Classic 350 is a very good-looking bike. With all the latest and modern features for the price point. Royal Enfield has resolved most of the issues that plagued the UCE(Unit Construction Engine) Classic 350 by making it more refined, more feature-packed, and at the same time. I took the test drive of the bike, and I am impressed."
Royal Enfield Classic 350,4.2,I have a classic 350,4,"I have had a classic 350 for 3 years. The engine is BS4. If I talk about the performance it's a superb bike on any type of road. The balancing, the pick-up, and the handling all are superb. "
Royal Enfield Classic 350,4.2,Mileage Disappointing,4,"Overall experience is good, but as I own the new Classic 350. I'm getting the mileage of nearly about 20kmpl in city rides. Which includes the highway, but very less and disappointed with it."
Royal Enfield Classic 350,4.2,Best Bike,4,"The Royal Enfield Classic 350 is the Best bike. The looks, comfort, and maintenance were also good."
Royal Enfield Classic 350,4.2,Best Bike,5,This is the best bike and has good stability. Its control is very good with no vibration and no sound pollution.
Royal Enfield Classic 350,4.2,Happy With The Performance Of The Royal Enfield Classic 350,4,I'm happy with the performance of the Royal Enfield Classic 350 and I feel very comfortable riding.
Royal Enfield Classic 350,4.2,Good Bike,4,One of the best bikes for city mileage and performance is awesome as per the vehicle. The looks of the vehicle are amazing.
Royal Enfield Classic 350,4.2,Overall Wonderful Experience.,3,"I have purchased bs6 model in Feb 2020. I have completed 21000km, and the overall experience was wonderful, but still, as I have told you that I have bs6 which means this bike came with problems as well because of their EFI engine, but this is the only problem. Overall Royal Enfield it's emotions and feelings and even at my home there are 5 vehicles, but all the time my grandfather used to go with Royal Enfield. It feels great and this is the only thing that I have purchased."
Royal Enfield Classic 350,4.2,Overall Good Bike,4,"Pros-  Overall it's a very good bike. The engine is extremely smooth it feels like Royal Enfield used Japanese technology in the engine, seating posture is very comfortable. The feel of the bike is nice. Cons- suspension is not good it's too soft. The heating issue is there and mileage is also not good poor."
Royal Enfield Classic 350,4.2,Awesome Bike with Good Mileage And Safety,4,"It looks awesome bike with good mileage, and safety is better than other bikes. It is a comfortable bike and has no vibrating like other bikes. Also, it is better for long distances. "
Royal Enfield Classic 350,4.2,Best Performance,4,"I think the battery is all thing in Royal Enfield 350 Classic very good skylight its weight comfortable seat height seat is comfortable in it ladies if all people can sit it's looking it's what I find it awesome and all its spare parts are very comfortable And its cost expenses are also available maintenance cost The maintenance is also very good, it comes very cheap so that's why I like old Enfield bikes very much especially Classic 350."
Royal Enfield Classic 350,4.2,Amazing Bike,4,"No matter how many changes Royal Enfield makes in its bike Classic, will be loved due to its throttle sound, which is softer now. The engine performance has increased in its new version. Stiffness can be felt in riding quality."
Royal Enfield Classic 350,4.2,Riding experience is amazing,4,The bike is excellent. This bike is very excellent and this is a royal bike and its maintenance is very high and this is a very beautiful bike and fantastic mountain and plane riding this is a bike in attitude style this silencer is a better sound and on are better and modified bike it is nice
Royal Enfield Classic 350,4.2,Nice Bike With Good Looks And Mileage,5,Nice bike with good mileage and looks. This bike for legendary powerful engine and nice braking with a good starting sound.
Royal Enfield Classic 350,4.2,Most loved and admired of all,5,One of the most loved and admired bikes of all time. RE 350 is a Classic bike that is desired by many and the waiting period is justified in such a manner. I bought the Classic 350 in April 2022 in black matte finish color and the confidence it gives while riding is unmatchable with any other bike. The average is superb so is engine refinement. Anyone considering buying Classic 350 then the price range starts from 1.90lacs ex-show of base variant.
Royal Enfield Classic 350,4.2,Ride quality is amazing,4,"Overall, the ride is of good quality. The sweet spot of the engine is between 70 and 80 km/h; above that, it can go up to 115 to 120. But because this is a cruiser bike and not a racer, it's good enough. The bike has attractive looks and an unrivalled retro appearance. Excellent performance for a city ride."
Royal Enfield Classic 350,4.2,RE never disappoints,4,"The pricing of a brand-new Classic 350 with dual channel ABS in the front and rear is 2.17 lacs ex-showroom. A USB charging port is now provided in all RE bikes of the 2022 model, which is a modern improvement. The seat cushion has been enhanced, making for a more pleasant ride."
Royal Enfield Classic 350,4.2,Great Appearance,4,"The Royal Enfield Classic 350 is well-known for its appearance - the sound, and pickup, despite the fact that it is heavy but comfortable to drive. It has a medium to low mileage.If ridden within acceptable limits, the bike will exhibit a higher than perceived fuel efficiency"
Royal Enfield Classic 350,4.2,Sturdy build quality,5,"Classic 350, The ride quality of this bike is very smooth and comfortable. The mileage is not that bad, but its maintenance cost is high. if you need a better ride quality and are passionate about having a bullet, go for it. Also important to note is that this bike does not contain a single piece of plastic, It has a sturdy build quality."
Royal Enfield Classic 350,4.2,It has everything classy,4,"As the name says, the most classic bike of all time, Royal Enfield's Classic 350 is a cruising bike that gives mind blowing mileage of 34kmpl. Very fuel efficient, and the build up quality is just amazing. A little heavy, but amazing comfort can be felt due to the adjustable twin shock absorber rear-end suspension. The top variant is a little too expensive. "
Royal Enfield Classic 350,4.2,The bike's appearance is enticing,4,"With an incomparable old-school flair. The performance is superb for a city ride. Because to vibration, the roadway beyond 80 is ordinary till 100. For a new bike, servicing is too costly. Maintenance is especially costly, given that the city average is 28/30 km/l. The pros include the bike's beauty, regal feel, and goodwill, as well as its longevity; the drawbacks are its pricey maintenance and top end owing to vibration."
Royal Enfield Classic 350,4.2,Classic 350  provides comfort,5,"Providing the greatest customer service is Royal Enfield. It was simple to purchase the Classic 350. With regards to offers and colour choices, I received support. and it was a great pleasure to ride. a strong engine, strong off-road ability, and a comfortable upright riding position. a sturdy bicycle for long distances. It provides comfort as well as dependability."
Royal Enfield Classic 350,4.2,Best for City Ride,5,"The brake arrangement is ideal for city riding. Even if it could take some time to analyse stopping distances, the brake arrangement is ideal for city riding. Although the suspension isn't quite as good as you might think, there is additional seat support for better comfort. Although it feels hefty, the bike is dependable, and because the seat is low, it is somewhat simpler to handle. Although the bike lacks some agility when taking tight turns, the lower centre of gravity also makes it excellent at slower speeds."
Royal Enfield Classic 350,4.2,Classic 350 is a good bike,4,"Royal Enfield Classic 350 may appear cosy and positioned, but riding it over long distances requires wind protection because the rider sits totally upright. When consuming kilometres, a screen is quite useful due to its vulnerability to wind."
Royal Enfield Classic 350,4.2,Classic 350 best for comfortable riding,5,"Royal Enfield Classic 350 has comfortable seats,  you even get some back support from the upward contouring at the very end of the rider seat. These ribbed coverings provide ample grip, preventing you from sliding back and forth. In fact, the cushioning is so effective at absorbing bumps within the first few minutes that it is."
Royal Enfield Classic 350,4.2,Classic 350 great Experience,4,I purchased it 9 years ago. I was pleased with the ride. Bike seems to have muscle. The output is decent. But the servicing is the primary issue.  therefore upkeep costs are considerable. Bicycle components aren't all that great or durable. components need to be replaced on a regular basis.
Royal Enfield Classic 350,4.2,My Favourite Is The Classic 350,4,"I've had roughly 20 different motorcycles over the years, and I've finally discovered one that combines every aspect that makes riding a motorbike a genuine delight. The Enfield is a joy to ride and is lightweight, uncomplicated, affordable, and easy to manage. That 500cc single's sound is nonstop audio bliss. All the bikes I've owned have been fun to ride, but my favorite is the Royal Enfield since it's so much fun!"
Royal Enfield Classic 350,4.2,Classic 350 - greatest bike,5,"I have ridden many bikes in a variety of categories, but there is no comparison to the greatest and most iconic model of all time, the Royal Enfield Classic 350. As such, there is nothing about the Classic 350 that would make me give it up. In a market with competitors, it stands firm and traditional."
Royal Enfield Classic 350,4.2,Classic 350 is amazing,5,"Royal Enfield classic 350 gives me a unique sense to ride it on the highway. Flowing and balanced. Strong bike. You feel magnificent riding this bike. Even during the wet season, this bike does not slip and keeps its grip on the pavement. The best bike for a lengthy journey, although the engine takes forever to warm up."
Royal Enfield Classic 350,4.2,Royal Enfield Classic 350 is my love,5,"Every time I drive my Royal Enfield Classic 350, I feel more assured. It delivers outstanding mileage and unrivalled pick-up. My favourite part of the Classic 350 is how the aesthetics and design are kept simple. A new colour option variety is a wonderful way to draw customers."
Royal Enfield Classic 350,4.2,Royal Enfield Classic 350 - Excellent features,5,"The new Royal Enfield Classic 350 has a zippy engine and comes under the affordable pricing range. It feels effortless to drive, even on bumpy and uneven roads. With only one driving experience, it can wow anyone, whether, it's because of the suspension or the overall outstanding fit and finish that’s up to the person to judge."
Royal Enfield Classic 350,4.2,Classic 350 - serve as my long-term vehicle,4,"I have been picturing myself navigating the stunning and perilous roads of Ladakh. I had imagined myself travelling through icy conditions and crystal-clear sky just to arrive at Pangong Lake, where I would park the saddled-up Classic 350 and take some priceless photos."
Royal Enfield Classic 350,4.2,Royal Enfield Classic 350 - Fully Satisfied,5,"I have two bullets, the newest is made of far lower-quality materials than the older one, and both are current models. and the vibrations are lessened compared to older models, the motorcycles' riding comfort is significantly superior. Initial torque is not that fantastic, but the mid and high-end it rocks out. A well-kept bike can obtain about 40 kmpl in mileage, and after-sale service is not that excellent in Enfield showrooms, so I recommended outside servicing, and I'm delighted with their job."
Royal Enfield Classic 350,4.2,Classic 350 is an iconic bike,4,"The Royal Enfield Classic 350 is an iconic bike with some excellent upgrades. I adore the bike, and the revised suspension and seats are wonderful. The motorcycle now even has a semi-digital cluster, which was desperately needed. I enjoy this bike's unique feel and the whole experience. "
Royal Enfield Classic 350,4.2,Classic 350 deliver Great Performance ,5,"When you are looking for perfect combination of performance and comfort, classic 350 is the best motorcycle. It really offers the smoothest ride. The BS6 engine is so much powerful to provide sufficient torque. The bike is also well-balanced and easy to maneuver in traffic. Additionally, the maintenance cost of Classic 350 is affordable."
Royal Enfield Meteor 350,4.1,Best Cruiser,4,"The bike is superb, has a great riding experience, is super comfortable, and gives expected mileage. I was confused between Classic 350 and Meteor 350 because Classic gives a more muscular look as compared to Meteor but the features coming in the Meteor are great. "
Royal Enfield Classic 350,4.2,Royal Enfield Classic 350 Great Bke,5,"We all know what a Royal Enfield is capable of in terms of performance. The highest speed of the bike is around 130 km/h. At various rpms, there may be some vibrations, but for me, it wasn't a major concern, and it didn't have an impact on how I felt overall. You might anticipate a speed of about 30 km/h. Regular repair and maintenance are required for the royal enfield classic 350. The bike's parts are readily available, and maintenance expenses are affordable. The bike's spare parts might be pricey in comparison to other bikes in its sector, which is the sole drawback.A few advantages of the royal enfield classic 350 are its vintage appearance, comfortable riding posture, easy handling, and reliable performance. The bike's drawbacks, though, are high maintenance expenses and pricey replacement parts."
Royal Enfield Classic 350,4.2,Premium Looks And Good Safety Feature,4,Nice looks and performance are very good on the road and off-road anywhere very good performance but the mileage is not at 41 kmpl around 30 kmpl but it's nice.
Royal Enfield Classic 350,4.2,Great Seating Position,4,"The Royal Enfield Classic 350 offers a comfortable ride experience, with a well-padded seat and an upright riding position that reduces fatigue on long rides. The bike's suspension system, with telescopic front forks and twin gas-charged shock absorbers at the rear, delivers a smooth ride even on rough terrain. One of the standout features of the Classic 350 is its retro styling, with a classic round headlamp, a sculpted fuel tank, and elegant chrome detailing. The bike also offers modern features like a digital instrument console, an LED tail lamp, and an electric starter."
Royal Enfield Classic 350,4.2,Overall Good,4,We are comfortable in riding Nice looks smooth transmission but gives mediocre mileage lower than expected
Royal Enfield Classic 350,4.2,Perfect Bike,4,"Overall, the Royal Enfield Classic 350cc is a reliable, durable, and stylish motorcycle that is perfect for those who want to experience the joy of riding."
Royal Enfield Classic 350,4.2,Classic 350 Is Iconic Bike,4,"The Royal Enfield Classic 350 is an iconic motorcycle that blends traditional styling with contemporary technology. A 346cc air-cooled engine provides the bike's smooth and strong riding experience. The Classic 350 offers a retro-inspired appearance, with a circular headlamp, teardrop fuel tank, and a chrome finish. The bike also has several innovations, including dual-channel ABS and a computerized instrument cluster. The handling and braking capabilities are superb, and the ride is smooth and pleasant. Overall, the vintage 350 is a wonderful option for anybody searching for a vintage bike that doesn't sacrifice performance."
Royal Enfield Classic 350,4.2,Timeless Charm and Classic Appeal: A Review ,4,"Fuel Efficiency: The Classic 350 is not particularly fuel-efficient, especially when compared to modern commuter bikes. Its mileage can vary depending on riding conditions, but on average, it delivers around 30-35 kilometers per liter of fuel, which may be a consideration for those with long commutes or frequent rides."
Royal Enfield Classic 350,4.2,Good Design And Comfort,4,"My boyfriend's Royal Enfield Classic 350 is very precious to us. As pillion riders, we shared countless beautiful memories on this iconic bike. Its classic style, particularly in the lovely blue color, lent a sense of class to our trips. The engine's pounding sound and the plush seats made each trip unforgettable. The Classic 350 never failed to entice us, whether we were visiting the gorgeous countryside or riding through city streets. The bike's dependability and smooth performance allowed us to make special experiences together, and my boyfriend's affection for his Classic 350 grew greater with each passing day."
Royal Enfield Classic 350,4.2,Good Performance,4,"I recently had the pleasure of experiencing the Royal Enfield 350, and I must say, it left an indelible mark on my riding journey. This iconic motorcycle exemplifies everything that makes Royal Enfield a legendary brand, combining timeless design, solid craftsmanship, and an unmatched riding experience. Allow me to share why the Royal Enfield 350 deserves its esteemed reputation."
Royal Enfield Classic 350,4.2,Amazing Bike,4,The Royal Enfield Classic 350 is a bike of joy that gives the rider a royal experience and great pleasure.
Royal Enfield Classic 350,4.2,timeless design and offers a relaxed cruising ,4,"Its retro charm and comfortable ergonomics evoke a sense of nostalgia and freedom. The Classic 350's torquey engine and smooth power delivery create a laid-back and enjoyable ride. However, the bike's weight may require some effort for maneuvering. Additionally, the braking system could be more responsive. Nonetheless, the Royal Enfield Classic 350 remains a popular choice for riders seeking a classic cruiser with an old-school appeal."
Royal Enfield Classic 350,4.2,It's a best bike for wvery one,4,"Royal Enfield Classic 350 is the best bike for mileage, speed, consistency, and much more. If you are looking for a bike which is best for money then you can go with it."
Royal Enfield Classic 350,4.2,"First and foremost, the Classic",4,"First and foremost, the Classic 350's design is an absolute head-turner. The retro styling, with its teardrop-shaped fuel tank, chrome accents, and classic lines, exudes a charm that is hard to resist. It truly stands out on the road and invites admiration from fellow riders and onlookers alike.When it comes to performance, the Classic 350 doesn't disappoint. The 346cc air-cooled engine may not be the most powerful in its class, but it provides ample torque and acceleration for both city commutes and long rides.Ride quality and handling are where the Classic 350 truly shines. The seating position is comfortable, allowing for hours of enjoyable riding without fatigue. "
Royal Enfield Classic 350,4.2, Retro and Stylish Cruiser Motorcycle.,4,"""The Royal Enfield Classic 350 is a motorcycle that combines traditional styling with ACpractical interchange options. Its retro style and recognised look capture the spirit of a vintage motorcycle. The Classic 350 offers a smooth and pleasant ride because to its well-padded seat and subdued design style. Due to its pleasant riding environment, it is perfect for both short and long peregrinations. The 350-cc motor is the ideal option for daily journeys since it offers decent availability and appropriate power. The Classic 350 also includes a variety of noteworthy features, such binary-channel ABS."
Royal Enfield Classic 350,4.2,Royal Enfield classic 350 - Dark Stealth Black. ,3,"I recently purchased the Classic 350 Dark Stealth Black edition in April, and overall, it has been a satisfactory experience. This variant comes equipped with dual-channel ABS, adding an extra layer of safety to my rides."
Royal Enfield Classic 350,4.2,A true marvel in the realm of motorcycles,4,"The Royal Enfield Classic 350 continues to mesmerize riders worldwide. With its timeless design and unparalleled performance, it effortlessly stands apart. The invigorating thump of its engine and seamless ride elevate every adventure. Be it conquering highways or maneuvering urban landscapes, the Classic 350 glides with grace. Its robust construction and dependable mechanics guarantee a lasting companion on open road. For those in pursuit of a harmonious blend of elegance and power, the Royal Enfield Classic 350 unquestionably reigns supreme"
Royal Enfield Meteor 350,4.1,Fantastic Bike,3,This bike looks fantastic and feels very good when you ride it.
Royal Enfield Meteor 350,4.1,My friend has Royal Enfield Meteor 350,5,"It is a modern classic cruiser which looks so hulky and have modern features. it has very comfortable riding seat, support back very well for long rides. It delivers smooth and refined ride, and a responsive engine with ample power for city and highway riding. Advanced features include a semi-digital instrument cluster, LED lighting, and a USB charging port. RE Meteor 350 has quite efficient mileage of 34 kmpl, which matches its power. The servicing is so easy and quick."
Royal Enfield Meteor 350,4.1,Meteor 350 is the ideal bike,4,"The Royal Enfield Meteor 350 is the ideal motorbike for someone who wants to commute frequently. Long and city journeys are both comfortable. It has good features, comfort, and performance. This bike is a perfect deal all around."
Royal Enfield Classic 350,4.2,Vintage-inspired And Timeless bike,4,"The Royal Enfield Classic 350 is a cruiser that consolidates conventional styling with ACpractical exchange choices. Its retro style and perceived look encapsulate a rare bike. The Exemplary 350 offers a smooth and wonderful ride on the grounds that to its very much cushioned seat and repressed plan style. Because of its charming riding climate, it is ideal for both short and long peregrinations. The 350-cc engine is the ideal choice for day-to-day travel since it offers nice accessibility and fitting power. The Exemplary 350 likewise incorporates various important highlights, such as double channel ABS."
Royal Enfield Meteor 350,4.1,Comfortable Ride,4,"Royal Enfield Meteor 350 is a very comfortable ride as per my personal experience.We can say the bike is best in it's class. Engine refinement is amazing and braking is smooth which ensures the amazing long rides experience. Also navigator display is a useful feature for me as a traveller. Looks and road presence of bike is amazing. Also, the bike is pocket friendly with a decent mileage of 35-40 and low maintenance and service cost. I am also happy with the well designed seating for good posture."
