Varient_Name,Average_stars,Review_title,User_rating,Review_description
Honda Unicorn,4.0,Good Bike And Excellent Features,4,"Good bike and excellent features, good performance, and also mileage and value for money to buy this bike I like it so much."
Honda Unicorn,4.0,Build Quality Good,3,Honda is an average bike of 150CC segments in India.
Honda Activa 125,4.2,Nice Scooter,5,It's the best option for family members. 2 people can sit easily. The look and feel are good with nice features.
Honda Activa 125,4.2,Best Vehicle,3,"Engine power and pickup are decent. Features are also good. Front glove box, side stand cut off, automatic engine off, outer double fuel lid, and a stylish look. The top speed is 90 km/h with a person of 70 kg weight sitting. The driving experience is smooth at high speeds also. And it is giving a good mileage of 45kmpl but remember a trick to increase mileage drive on economy speed between 35 to 50kmph."
Honda SP160,4.3,Good Design,4,"This bike provides us with good mileage, power, and a particularly attractive appearance, which gives us an overall decent look."
Honda Dio,4.1,Honda Dio Is The Best,4,"Honda Dio is the best Scooty. I love it most, and its features are best in comparison to other Scooty."
Honda Unicorn,4.0,Excellent Family Bike,4,"Except for the price, Unicorn continued its success journey with respect to its performance, mileage, and safety. Yet to start the free services."
Honda CB350RS,4.0,My review of the bike I purchased ,4,Best in class fit and finish.
Honda CB350RS,4.0,Value For Money,4,"This is a good bike with great looks and performance. Worth it to buy and the braking system was very good. Its seat is very comfortable for long rides, this is a value for money."
Honda Dio 125,4.0,Best Scooter,4,The Honda Dio 125 provides the best experience. It offers unexpected mileage and comes in very attractive colors.
Honda Dio,4.1,Honda Dio Is The Finest,4,This scooter is the finest for getting around town because of its fashionable design. I wish to get this scooter since it has a fashionable appearance and has higher gas mileage than the Activa 6G at 48 kmpl. We are all purchasing the Honda Dio scooter these days in order to travel comfortably. I want to get it soon since it has a led light design.
Honda CD 110 Dream,3.9,Great Mileage,4,I'm writing this after 2 months of driving my Honda CD110. Really it is more comfortable and looks very nice than Splendor. This bike gives great mileage. This bike has great looks. 
Honda Hornet 2.0,4.0,An Average Bike.,3,There is no mileage mentioned by the company and ground clearance is too low 167 as the unicorn. There should be a lady's footrest. I don't think so it's quite suitable for a double seat there should be some extra seat space in the back seat.
Honda Dio,4.1,Good Performance,4,Good experience to use it on daily basis. Good performance with fuel and off-road as well. Mileage is good and it has a smooth engine so it gives a great rides quality. Easy to handle. Go for it.
Honda CD 110 Dream,3.9,Great Budget Bike,4,A good budget vehicle with low maintenance cost and great mileage. It is so good to use for a drive.
Honda XBlade,4.1,Excellent Bike ,4,"Best bike for mileage and performance, sporty look good for a long drive, excellent road grip."
Honda XBlade,4.1,Awesome Bike,5,Best bike in India at a low price at any place in India. Mileage is also best.
Honda XBlade,4.1,"Really, one look is enough ",5,"Super stylish, low maintenance, heavy powerful, mileage, extraordinary bike at this price. Really, one look is enough."
Honda Livo,4.2,Great Bike With Great Mileage.,4,"The Honda Livo  is very nice bike I like it, "
Honda Livo,4.2,Honda bs6 Livo review after riding 600 kms,4,"Honda bs6 Livo is the best commuter bike in milage, most stylish among 110cc bike after running 600 kms. I am reviewing, I am getting 80+ mileage for 1ltr.   Smooth & efficient engine in 110cc, the best bike for officials, pickup is good in 50 to 60 kmp speed with commuter, with Pillon may slightly down the pickup, road grip is excellent even does not get vibrated in '80s. Good for highway little bit irritating in village roads due to sudden changes in gear. The bike is Not for showoff & stunt's purely mileage cum official bike, best in below 60kmph."
Honda Livo,4.2,Best Bike In This Segment,4,This is a class bike and its fuel efficiency is very good and its performance is also amazing. This bike has better look with modern features and its price is bit costly.
Honda Livo,4.2,"It's An Excellent Vehicle, ",5,"It's an excellent vehicle, better mileage, and good performance, but one disadvantage is poor chain sprocket, to be changed, "
Honda Livo,4.2,Awesome Bike,4,Nice pickup and look.
Honda Livo,4.2,Not satisfied with this bike.,2,"I am using this bike for the last three years mileage is only 40, and it vibrates so much after you cross the speed of 50, parts not available so easily in the market."
Honda Livo,4.2,Mileage machine ,4,"I owned this bike for the last 3 years and have driven 70000 km. No issue to date. One thing can remember is. This is not a performance-based machine. That only goes 60kmph, and then enjoy riding with the best mileage."
Honda Livo,4.2,I liked it,5,I liked the colour of the bike and its mileage is so good. I can carry 3 people easily I loved this bike. 
Honda Livo,4.2,Amazing Bike (:,5,"Best 110 cc bike with amazing aesthetics, comfort, and mileage. (60+kmpl) I own a matt grey colour. It looks dashing with a muscular fuel tank design. A decent instrument cluster simply provides all the necessary info. And the exhaust sound is also nice. "
Honda Livo,4.2,Honda Livo Bs6 Sporty And Comfortable,5,It's the best bike for students like sporty and comfortable. Its mileage is also very best. It is excellent.
Honda Livo,4.2,Good Commuter Bike,4,"Honda Livo is a best-in-class commuter bike. It's slightly expensive compared to similar price range commuters offered by other manufacturers like Hero Passion Pro, Bajaj CT 100 and Hero Splendor series. However, comfort and convenience this bike gives is at different level and other bikes can't compete at such price range. Some people would opt for Honda Shine 125 because it is in same price range and offers 125cc engine. But if you are mileage conscious then you should consider buying Honda Livo. The engine of the bike is very smooth and comfortable for long-range. It gives a good and consistent performance. The service cost of the vehicle is pretty low."
Honda Livo,4.2,This Is A Good Bike,4,This bike is good and gives good mileage. It doesn't disappoint me with the price.
Honda Livo,4.2,Best Bike,4,Nice product it has comfortable seats and decent mileage. Speed is also nice in this segment.
Honda Livo,4.2,affordable bike with awsome mileage.,4,"Very nice bike, I have a Honda live with the best mileage, maintenance cost is very low and budget bike everyone can afford it."
Honda Livo,4.2,Really Nice Bike ,4,"Really nice and wonderful experience with this Bike. Greatly, it's the mileage is awesome and comfortable feeling with this. "
Honda Livo,4.2,Good Scooter,4,"Best scooter for students. The mileage is good, performance is also good and features are the very best."
Honda Livo,4.2,Performance,4,a very good bike I have also this bike total of 120000 km total ride this bike and today is very good mileage and is very best. very good for this cost.
Honda Livo,4.2,Good Performance,5,Good bike with fine mileage and engine quality is great. The performance is also good in that price range.
Honda Livo,4.2,Is Very Comfortable,3,"The Honda Livo is an incredibly comfortable bike that fits well within a budget. I find this bike to be amazing in practicality, using it on a daily basis with great satisfaction."
Honda CBR650R,4.5,Dream launches ,5,No option needed..looking charming speed that can help you talk to with wind
Honda Livo,4.2,Good Design,4,"First of all, the bike's look is stylish and impressive. It gives the feeling of youth and modernity. The engine sound of the bike is good and not disturbing."
Honda Livo,4.2,Amazing Performance Bike,5,"It's an excellent bike with lots of attractive features one would rather get at a much more price than the Honda Livo. Thanks, Honda company for making such a comfortable, beautiful bike. "
Honda CBR650R,4.5,Awesome Bike,5,This is a superb bike and I think this bike is one of the most premium bikes in India.
Honda CBR650R,4.5,Good system,5,It's very comfortable for everyone. I highly recommend you. 
Honda CBR650R,4.5,Cool Bike For Racers,4,I Am A Racer And Guys All Knows That Racer Want Speed To Win A Race And My Dad And My Uncle Gifted This Bike To Me On Birthday So The Experiance With This Bike Is Fabulos So If You Are Looking For A Racing Bike Then The Honda CBR650R Is Build For You
Honda CBR650R,4.5,Best reliable and refined bike,5,Awesome and the best ever 600 CC category bike with low maintenance cost and reliability.
Honda CBR650R,4.5,Future bike of riders,4,Best bike in all over the world with the traction control system.the bike worth Rs. 8lakh around on-road price. This bike has two colours and red and white colour is the deadliest colour.
Honda CBR650R,4.5,Best Bike ,5,"This bike looks good and its 4 cylinder engine, its quit fast to change gear."
Honda CBR650R,4.5,A great bike,5,I had this bike for a couple of months. It is my brother's bike. The bike is punchy and refined at the same time. It looks sporty and has a committed riding position. Good for a short-medium ride. Will not recommend for touring. It's a monster on the track. The 4 cylinder engine feels buttery smooth on the track.
Honda CBR650R,4.5,Top bike in 650 CC segment,5,"Honda CBR 65R is a very nice bike, As per the previous bikes of Honda. In this segment, this bike is heading lead and it is also my dream because of its sound and power."
Honda CBR650R,4.5,Best In This Segment ,3,Very good bike and best bike in 650CC in this segment. Good average plus nice-looking and look like 1000CC and it has good power.
Honda CBR650R,4.5,Good Sports Bike Under 10 Lac,4,"This bike is a good sports bike under 10lac. The power of the bike is great, and the look is value for money. The speed is also good, and the most important part is it has a good quality of safety provided by the company."
Honda CBR650R,4.5,Performance Is Great,4,"It's freaking good, the performance is just outrageous. Comfort is just perfect, did many long trips and won't feel uncomfortable."
Honda XBlade,4.1,BEST BIKE OF 2020,5,This is the best bike under the high segment. The engine is very smooth which helps me in getting the best riding experience.
Honda XBlade,4.1,Best Bike Ever.,5,What can I say about X-Blade.
Honda XBlade,4.1,From FZ V3 I Switched to Xblade,4,"I almost thought of taking FZ V3, after riding both the bikes I changed my mind to honda, engine smoothness & refinement is great. Xblade came up with great looks & BS 6 Fi engine of 163cc which wins over Yamaha. Overall nice bike with big display & gear indicator, pillion rider is not very comfortable on long rides that's the only drawback in this bike.  "
Honda XBlade,4.1,Beautiful Bike,4,It's an amazing bike with a comfortable seat. Its mileage is superb and the front look is beautiful.
Honda XBlade,4.1,Disadvantage Of The Bike,4,"First thing lightings are worst. When it comes to the highway or one way while yellow light bikes opposite vehicle's passes, mean our white lights won't be visible. I feel halogen lights are better for this XBlade instead of LED lights. 2nd disadvantage is seat cushions are like a wood plate. Body full of fibre easy to break and fade. On potholed roads, we can get each body part's vibration. Front tyres are very thin like Splendor bikes so braking is worst. The next thing side stand is not sufficient to carry 140kgs of bike weight. Plastic button locks one lock is broken means need to change that whole part. The button locks will expand the gaps of each body's fitments. Metal body means we can have the same fitment gaps till the end of bike life. Plastic moulded fibre tank. The fork is very weak and thinner like the Splendor bike. "
Honda XBlade,4.1,Worth Buying,4,"My x-blade bs6 double-disc deluxe (black color) have just completed 3,001 km . I ride through highway town as well as village non metal roads absolutely on regular basis. Till date I didn't face any trouble by any means. Engine performs as per, suspension system is awesome, riding posture is like a Perfect Commuter and mileage is varying from 44-53km/l(according to my travel) Honda X Blade bs6 has the most power-packed, versatile engine in its category. Worth buying."
Honda XBlade,4.1,Excellent Bike,4,"A great bike for everything, comfort, mileage, looks, and more. A nice silent start is a very nice thing that I personally like. Honda serves us very well. Pick-up is great. Also, the full digital meter it gives you looks nice and the live averaging is the best I've ever seen. My personal advice is to buy this."
Honda XBlade,4.1,Bike Is Overall A Budget Performer,4,The bike is overall a budget fit and performance equipped in its category and stands fit in competition. A little improvement needs in aesthetics as the headlamp appears a little bit elongated which does not look bad. The rest of the things are fine. Japanese engine is best in its peak performance.
Honda XBlade,4.1,Honda X-Blade is a decent bike,5,"Honda X Blade offers good engine performance and excellent features. The starting price range is 1.15lacs approx, which seems affordable in terms of engine and fantastic fit and finish just simply adds to its definition."
Honda XBlade,4.1,Good And Stylish Bike,3,You can go for it. It is a stylish bike with medium power. ABS for safety is available on the front brake. You can expect an average mileage of 46 km.
Honda CD 110 Dream,3.9,Value For Money,5,The best bike in 110CC. The bike has a engine start/stop switch which helps me in getting more mileage. 
Honda CD 110 Dream,3.9,Best Bike Ever,4,This bike is very nice and it is perfect. It gives good mileage and it has a nice maintenance cost and pick-up is also good.
Honda CD 110 Dream,3.9,HONDA WORST VEHICLE,1,"In two years two times engine work has been done, one from the company and one time from outside. Purchased in March 2018."
Honda CD 110 Dream,3.9,This Bike has Sab Kuch.,4,This bike is very nice and it is perfect. It gives good mileage and it has a nice maintenance cost and pick-up is also good.
Honda XBlade,4.1,Waste Of Money,2,"Cons: cost-cutting in every part. After 2 years of use, the speedometer and headlight did not work properly, chainset was gone. Don't waste your money on this vehicle, go with another option."
Honda CD 110 Dream,3.9,"Good Bike To Roam Locally, Not For Speed Above 70",3,"I own bs4 version of this bike. All good esp, good mileage of 60kmpl on daily rides. Cons: jerky gear shifts, not confidence at speeds more than 70kmph as breaking in is not sufficient and tyre grip is not adequate. Sometimes faced issues in starting the bike. "
Honda CD 110 Dream,3.9,Awesome Bike,4,"I purchased CD 110 DLX in November 2020. The bike is awesome for average-budget people and for good mileage. Now, Splendor Plus is overpriced according to CD110, having good features than Splendor Plus. My overall suggestion is to go for this."
Honda CD 110 Dream,3.9,Best Bike For Families.,5,"Superb bike after one-month usage, I can say that it is very comfortable, easy riding with family best bike for families."
Honda CD 110 Dream,3.9,Good Bike For Family Riders,4,Honda Cd 110 bike is good for family rides. The rider feels very comfortable with the seat and suspension and the performance quality is awesome. 
Honda CD 110 Dream,3.9,Nice Bike For long Rides,5,"Very nice bike for long rides, and for city rides also with a nice pickup. It's nice for offroading also."
Honda Gold Wing,4.8,awasome,5,"A versatile bike that suits all needs in my opinion. I would definitely recommend anyone to get this bike, perfect for new and old riders. I particularly like the riding posture of the bike, the seat is nice and big meaning you can sit upright, or sit farther away for a more racing position. The engine is smooth and has a lovely upper powerband, although can pull easily in any gear. Nice sounding engine in the higher rev's, although can be a little quiet when cruising, which isn't always a bad thing. If I had to pick a fault it would be a tiny vibration at 2500 RPM, sounds like it's just a vibrating panel near the dash assembly. Although who rev's it that slow!"
Honda Gold Wing,4.8,Amazing bike.,4,Honda Gold wing is a super stylish bike and the power which is unbeatable for safety purposes. I prefer Goldwing and if we talk about mileage and maintenance that do not bed as performance if you want performance like Gold wing then you need to spent this little more. 
Honda CB350RS,4.0,Good Bike In This Segment,4,"Performance-wise this is a very good bike, engine refinement and mileage are also good. It comes with great features and its performance is just amazing. It's a lot better than other bikes in this segment. "
Honda Gold Wing,4.8,Good bike ,5,"The bike is extremely comfortable and I feel that the gold wing just glides in the road like a king. But when compared with the BMW 1600k grand America is better than Honda gold wing in terms of comfort. Otherwise, the gold wing is a very good bike."
Honda Gold Wing,4.8,Best in class.,5,The styling of the bike is amazing I am very much interested in this bike. 
Honda CB350RS,4.0,Really Good Machine,4,"I have been taking notes on my CB 350 RS for the past few months and I have to say, this is a really good machine that any younger anywhere in the world would love to have. For a Solo riding experience, this one offers an awesome experience due to its specially made seat. I won't say the same about the pillion seat though. The mileage returns on the bike look pleasing enough for a 350cc category and compared to the competition, it is far better. As Honda has already specified, the looks are targeted toward the younger audience, and yeah, the whole bike gets me excited the moment I see it. It has a powerful engine and is really great in its mid-range though it lacks a bit of torque compared to the rivals like the Royal Enfields. Its slightly aggressive stance also makes the bike engaging enough that you would never really get bored of it. If there is a drawback to this machine, it's got to be how dirty it gets. And not to be exaggerating, but this is a seriously bad drawback unless you decide to add some aftermarket fenders or huggers. Other than that, every other aspect of this machine is just so eco-friendly and well, this is a Honda. So, I would definitely recommend this machine to anyone who wants a nice and engaging but relaxed ride on our Indian pothole-ridden roads. "
Honda CB350RS,4.0,Honda CB350 RS is my love,4,"I’m so in love with my Honda CB350 RS as it has such nice and thrilling features. It gives a classic and retro look, which enhances its beauty to the next level. And the 350cc engine gives an excellent on-road performance. Plus, it is extremely affordable when I see all the features offered.,"
Honda CB350RS,4.0,Personal Review ,4,"The Honda CB350RS is a stylish and sporty motorcycle that offers a good balance between performance and comfort. It is an ideal choice for riders like me who are looking for a modern classic with a more aggressive design. The engine delivers sufficient power for daily commuting and occasional highway rides, while the handling and riding experience makes it enjoyable for me to ride in various conditions. The inclusion of features such as LED lighting and a semi-digital instrument cluster adds to its overall appeal. Overall, the CB350RS is a worthy addition to Honda's lineup and a strong competitor in the 350cc segment."
Honda CB350RS,4.0,Best In Segment,4,"Best in its segment, the engine performance is outstanding. However, the maintenance cost is slightly high. The styling is super and overall, it provides great value for money."
Honda SP 125,4.2,Honda SP 125 excellent pickup,5,"A year ago, I purched this. The colour scheme and design of this bike appeal to me. The metre console is very appealing. This bike's alloy wheels are nice. I've listed some aspects below, both favourable and unfavourable.PROS: This bike gets a fantastic 65 k.m./ltr. of mileage.This bike has a really smooth sound, as well as excellent pickup. The metre console design is awesome."
Honda SP 125,4.2,Honda SP 125 Terrible customer service,4,"You must be prepared to wait a few months in the event of any spare component failure. The service centre doesn't respond in a timely manner, and the level of service is subpar.Spare components are in great demand. In conclusion, the Honda SP 125 performs well on a regular basis."
Honda SP 125,4.2,Value For Money,3,"This is an amazing bike, it is good for the daily commute and it is affordable so it is good for the middle class-class family. The performance is great and is easy to maintain. Overall, this is value for money."
Honda SP 125,4.2,Reliable Choice,4,"A very good and reliable bike for daily commutes. Build quality is good, though not the best as compared to its BS4 variants. Rear wheel size and rear footrests are the worst in the 125 cc segment and for the price Honda charges. Have been riding for the last 3 years and clocked 42k km so far with an average of 73kmpl with 70% highways and 30% city rides. So far no change in the chain sprocket, nor the rear brake liner. All in all the bike is a good buy if our riding style is decent and when services are done at 5k intervals as suggested by Honda."
Honda SP 125,4.2,Bike performance ,3,The bike average is very good and maintenance cost is low as comparing another brand bike.
Honda SP 125,4.2,A Popular Choice for Daily Commute,3,Service Cost: The service cost of the Honda SP125 is average compared to other bikes in its segment. Regular maintenance and timely servicing can help in keeping the bike in good condition and ensure its longevity.
Honda SP 125,4.2,Honda SP 125: A Budget-Friendly Bike with Thrills,4,"The Honda SP 125 is a true gem on two wheels that my uncle purchased just last month. Right from the moment I laid eyes on it, I was captivated by its sleek and sporty design. The sharp lines and aerodynamic curves give it a contemporary look that turns heads wherever it goes. Its stunning looks are complemented by its excellent performance."
Honda SP 125,4.2,Best Commutor in 125 CC category.,4,"Best Commutor Bike In this 125 category. Overall design and style is awesome and the highlight of the bike is it's mileage, which is about 60kmpl"
Honda SP 125,4.2,Popular Commuter,4,"The Honda SP 125 is a popular commuter motorcycle offered by Honda in India. The SP 125 offers a comfortable riding experience, with a well-padded seat and upright riding posture. The suspension setup, consisting of telescopic forks at the front and twin shock absorbers at the rear, provides a decent balance between comfort and stability. "
Honda SP 125,4.2,Value For Money,4,It is value for money and well average with a low budget. It is good for road trips and mileage is always good. It looks like a sports bike and feels like you ride a sport bike.
Honda SP 125,4.2,SP 125 Has Low Maintenance Costs,4,"You can go for a long drive with this bike, but you will need to stop for a break for 20 minutes every 150 km. The servicing and maintenance costs are low, and this bike is very good for daily use. It looks great and has excellent pickup, similar to the pulsar 150cc. It gets about 65 to 67 kilometers per liter. if I ride at a speed of 60 to 65 kph. A practical commuter with respectable performance and acceptable fuel economy is the Honda SP 125. Overall comfort is also respectable. However, the motorcycle's style and price are both overly conventional."
Honda SP 125,4.2,Honda SP 125 Has Great Power And Efficiency,4,"Lift your everyday drive with the Honda SP 125. This cruiser offers an ideal mix of force and productivity, making it an optimal ally for your ordinary rides. With its noteworthy mileage and smooth execution, the SP 125 guarantees an agreeable and charming drive. The bicycle's open to seating and very much planned ergonomics make it appropriate for long excursions too. The SP 125 likewise accompanies a scope of elements that clients appreciate, both with regard to its smooth outside and utilitarian inside."
Honda SP 125,4.2,Practical And Reliable Bike,4,"The Honda SP 125 is a no-nonsense commuter that gives decent overall performance and the right gasoline performance. The overall comfort is decent too. However, the design of the motorcycle is conservative and the pricing is pretty excessive, which doesn’t make it a budget-friendly motorbike. The 125cc engine delivers adequate electricity for everyday commuting and is delicate, offering easy acceleration. It gives awesome stability of electricity and gasoline efficiency, ideal for ordinary use. The coping is nimble and agile. Overall, the Honda SP 125 is a realistic and dependable preference for city commuting."
Honda SP 125,4.2,It Is A Good Bike,5,It is a good bike my back is giving 75kmpl. I am so happy to get this bike. Its look is very good. Its clutch and gear system are very good. Its petrol tank is awesome. Its speedometer looks very well. Its tires are very strong for all weather.
Honda SP 125,4.2,Decent Bike,5,"Recently, I bought this bike, and I must say, it not only looks appealing but also performs exceptionally well, especially with its fully digital instrument cluster. Additionally, it offers decent mileage, ranging from approximately 60 to 65, depending on your riding style."
Honda SP 125,4.2,Great Bike - Honda SP 125 ,4,Honda SP 125 is a great bike I ever saw in my whole life. I definitely want to try it out as soon as possible. 
