Varient_Name,Average_stars,Review_title,User_rating,Review_description
Royal Enfield Himalayan,4.1,Good Performance,5,"Royal Enfield bikes are very safe to drive, and the body kit's style is excellent. Even during the journey, they won't trouble riders. It's the most comfortable bike ever made, and for riders, it's a number one choice. Royal Enfield is always royal."
Royal Enfield Himalayan,4.1,Adventure-ready And Versatile bike,4,"The versatile and ready for experience The Royal Enfield Himalayan  is a bike worked for rough terrain and on-street use. Its strong 411cc motor gives it adequate power and a neckband for exciting rough terrain outings. The significant distance tension on board the Himalayan gives astounding shock inundation and gives harsh waves a remarkably pleasurable lift. The exquisite guest plan and delicate seat are an among riders since they take into consideration torment free, extended ventures. The Himalayan's colossally useful elements, such the sizable gear sack, windscreen, and mounting areas for extremities, make extremely long voyaging down to earth."
Royal Enfield Himalayan,4.1,Himalayan Is An Adventure Tourer Bike,4,"Royal Enfield Himalayan is an adventure tourer bike available in various variants and 6 colors with the top variant starting price from 2,28,490 rupees. Powered by BS6 motor 411cc air/oil-cooled engine that develops 24.3 bhp at 6500 RPM and torque of 32 Nm at 4500 RPM. Engine linked to a 5-speed gearbox and fuel tank capacity of 15 liters, equipped with disc includes dual channel ABS as s standard safety net. With high ground clearance and dual-purpose tires mounted on spoke wheels, its engine has lots of torque. Value for money can also be used for daily commuting."
Royal Enfield Himalayan,4.1,"bike performance was insufficient,lacked pleasure",4,"As a dedicated rider, I must say that the Royal Enfield Himalayan did not completely satisfy me. I just took it for a spin, looking for an exciting adventure, but it fell short of my expectations. The bike's performance was insufficient and lacked the pleasure I was looking for. While it was built as an adventure bike, it lacked the power and agility I desired. However, the Himalayan may still attract to those looking for a more calm and laid-back riding style, since it provides a pleasant and stable ride."
Royal Enfield Himalayan,4.1,Himalayan guarantees a solid ride,4,"Investigate nature and vanquish each landscape with the Illustrious Enfield Himalayan. This experience cruiser is meticulously designed to deal with assorted scenes and testing landscapes. With its rough plan and strong execution, the Himalayan guarantees an outright exhilarating and solid ride. The flexible suspension and strategic position freedom make it ideal for rough terrain experiences, while the happy-with seating and pragmatic highlights improve significant distance ventures. Set out on an excursion of investigation and embrace the soul of experience with the Illustrious Royal Enfield Himalayan."
Royal Enfield Himalayan,4.1,Best Bike,4,"The best bike in a low budget, offering better comfort, mileage, and ideal for long drives. It is definitely the best bike for all off-roading bike lovers."
Royal Enfield Himalayan,4.1,High Ground Clearance,3,"The Royal Enfield Himalayan is an excellent bike for long journeys. I rode this bike with my friends in Himachal Pradesh, and the experience was amazing. We have covered thousands of kilometres, and it is doing a great job. It is a perfect adventure bike with a mileage of 39+ kmpl on highways, which is very good. Unlike other bulky bikes, it is not bulky and has superb off-road capacity. I like this bike as its engine has a lot of torque, and it comes with high ground clearance. However, it has a high seat height."
Royal Enfield Himalayan,4.1,The best bike for riding.,4,"The Royal Enfield Himalayan is an enjoyable bike, and whenever you ride it, regardless of where you're riding, the comfort level is remarkable. Its braking system performs exceptionally well, even on challenging mountain roads. Moreover, in terms of sound and appearance, the Himalayan always stands out as an eye-catching beauty. People love to admire this bike due to its appealing attributes. Its weight is substantial; I had to move the bike to the side once due to pressure on the tire, and the tire got wedged, causing the entire bike to halt in traffic."
Royal Enfield Himalayan,4.1,Superb Bike In This Segment,5,"This vehicle is great for off-roading and provides a comfortable and dependable ride. The fuel efficiency is low, but it is perfect for a trip to Ladakh or for off-road biking adventures."
Royal Enfield Scram 411,4.1,Embrace Off Road Adventure With Classic Style,4,"The Royal Enfield Scram 411 is a stylish and adaptable motorbike designed for occasional off-road excursions and civic engagements. It delivers an excellent blend of authority and agility with its powerful 411 cc engine, enabling it to easily navigate its way through commerce in megacities. Riders may easily conquer beginner-level off-road trails with the Scram 411's advanced ground concurrence and off-road-focused suspense structure. Its retro-inspired project, which has knobby tires and speedster-phraseology exhaust, adds to its jaded pleading. Riders love the broad bars' good handling and comfortable seating arrangement."
Royal Enfield Scram 411,4.1,Overall Bike Is Really Good ,4,The overall bike is really good. It comes with aggressive looks and performance but it lacks in mileage. The new 411cc engine churns out impressive power and pickup but at a cost.
Royal Enfield Scram 411,4.1,Welcoming Bike Addition,4,A very welcome addition to the RE family. RE should also offer bikes with a tubeless tyre which is a desperate addition required from the customer and suitable abs. It certainly looks way better than Himalayan and provides great comfort than other bikes in this segment. The pedal positioning is just perfect and it feels more defined along with a lively color combination and but yes it is a wee bit pocket friendly.
Royal Enfield Scram 411,4.1,Powerful Engine ,4,"Excellent bike to ride in the city as well as off-roading. Powerful engine, smooth riding, and much more comfortable riding. "
Royal Enfield Scram 411,4.1,The Scram 411 looks good,4,"After a long and exhausting day at the office, the ergonomics and comfortable seats are much-appreciated. Additionally, the engine is quite smooth and doesn't require many gearshifts, which all together contribute to a less stressful commute."
Royal Enfield Scram 411,4.1,Best Bike In Terms Of Performance,4,"The Royal Enfield scram 411 provides good riding comfort and great posture. The handlebar is very comfortable. It is very easy to maneuver in city traffic. On Highways, the bike is smooth like butter. The exhaust sound is also good. The seating quality could have been better. It offers good mileage than Himalayan."
Royal Enfield Hunter 350,4.2,Adventure Bike With Style And Power,4,"I recently owned The Royal Enfield Hunter 350 is a motorcycle that offers a thrilling and exciting ride. It has a bold and muscular design that catches attention on the road. The engine provides a good balance of power and fuel efficiency, making it suitable for both city rides and highways. The Hunter 350 ensures rider comfort with its upright riding position and comfortable seat. It handles well, allowing riders to drive easily through traffic. The brakes are reliable, offering strong stopping power when needed. It has limited storage options for riders carrying backpacks and luggage."
Royal Enfield Super Meteor 650,4.3,Best For Long Rides ,5,"Best for daily commuting, best for long rides, and the best bike in India, This bike gives the best performance and returns good mileage. "
Royal Enfield Super Meteor 650,4.3,Good Bike ,5,"It is a very good bike, both from the point of view of looks and also in running, Royal Enfield is not just a bike, it is the emotion of the people. People should ride the bike once from km to km, I claim that after riding it, they will not be able to stop themselves because this bike is just as great."
Royal Enfield Super Meteor 650,4.3,This Is Super Bike ,5,"I think, this is a superbike, which offers great comfort in its seat. The braking system is great and it is very smooth. Just one problem, pick up is slow, rest all is the best. "
Royal Enfield Super Meteor 650,4.3,Wait Is Over - RE Super Meteor 650,5,The most premium bike from Royal Enfield has been finally launched. The looks are super awesome which can give tough competition to its competitors. Waiting for this bike on the roads.
Royal Enfield Super Meteor 650,4.3,Super Meteor 650 - admiring the new RE,5,"I like the newly launched Royal Enfield Super Meteor 650, and all the good and fine color options add more value to the bike. The 648cc engine is more refined and peppy, which adds thrill to the riding experience. The price range is a bit on the expensive side."
Royal Enfield Super Meteor 650,4.3,I love with Super Meteor 650,4,In love with this bike. I think it will be one of the best cruiser bikes and will give Harley Davidson feels. 
Royal Enfield Super Meteor 650,4.3,Super Meteor 650 is in affordable range,4,"Finally, after so months of waiting the Royal Enfield Super Meteor 650 has been launched. The price range is still on the affordable side in terms of rivals. But the looks are dashing and amazing. The riding experience has been easy and comforting."
Royal Enfield Super Meteor 650,4.3,Super Meteor 650 light and comfortable,4,"Thanks to its powerful low and mid-range torque, the Royal Enfield Super Meteor 650 makes the bike feel lighter than it actually is. The engine's strong torque can also be counted on to handle everything from overtaking to adjusting cruise speed. It's great for a cruiser that a 650 rider isn't disturbed by the need to plan and prepare to stay in the appropriate power band."
Royal Enfield Bullet 350,4.5,Best Old-School Bike,4,"In every way, the Royal Enfield Bullet 350 is the best old-school motorcycle. It has already created moniker of “Royal and Classic” bike in the Indian market over the past two decades. Bullet is renowned for its durability and built quality. The new BS6 engine is powered by a 346cc, single-cylinder, four-stroke, air-cooled petrol engine. The unit produces 19.8bhp at 5250rpm and 28Nm of torque @ 4000rpm and comes integrated to a 5-speed manual gearbox. It has the old-school rounded analog speedometer which looks more classy."
Royal Enfield Bullet 350,4.5,Great Bike In This Segment,4,"The engine is one of the Royal Enfield Bullet 350's most notable features. The engine is a 346cc, single-cylinder, air-cooled engine that generates 19.8 horsepower and 28 Nm of torque. Its engine is well-known for its smoothness and dependability, and it offers a pleasant ride even at high speeds."
Royal Enfield Bullet 350,4.5,Comfortable Ride,5,"The Royal Enfield Bullet 350 is known for its comfortable ride experience and classic retro styling. The motorcycle features a comfortable seat that is ideal for long rides, and the suspension system is designed to absorb bumps and rough patches on the road. The Bullet 350 also comes with a front and rear disc brake setup that offers excellent stopping power."
Royal Enfield Bullet 350,4.5,Everything is Royal about this bike,4,I recently bought Royal Enfield Bullet 350 with my own earned money. I was looking for a good comfortable bike for long and city rides and i made the best decision to buy bullet 350. This bike is so much comfortable and looks classy at the same time. It looks so antique and old school. I love everything about this bike.
Royal Enfield Bullet 350,4.5,Royal Enfield Bullet 350 my experience,3,"The bike's buttery smooth twin cylinder engine with tonnes of torque is among its many excellent features. Due to its low stress, the motor doesn't provide mind-blowing power but instead works smoothly. Notable features include the excellent chassis and stability at high speeds. Although they lack sensation and feedback at the levers, brakes are strong. Service has been provided at a reasonable price—roughly 3k—and of acceptable quality. About the drawbacks, I think the budget category is suspended because there is little rebound damping and they fast reach their lowest point. Even if the spread is good, the headlight throw might be improved. The tank's range isn't very far (between 200 and 230 kilometres), and."
Royal Enfield Bullet 350,4.5,Good Looking Vehicle,5,"The ride experience on the Bullet 350 is smooth and comfortable, With a torquey engine that provides ample power for cruising at highway speeds. The motorcycle's classic design is also a standout feature, With its old-school fuel tank and headlamp, Chrome accents, And spoked wheels. Overall, The royal Enfield Bullet 350 is a great choice for riders who value style and comfort on their rides."
Royal Enfield Bullet 350,4.5,Royal Enfield Bullet 350 Amazing bike,5,"The Interceptor. Future generations will decide. I really enjoyed interceptor. Driving is extremely cool. It is swift and powerful. It has two variations. Also, it is incredibly colourful and attractive from all angles. That is a fantastic bike. It travels a distance of 25 kilometres."
Royal Enfield Bullet 350,4.5,Royal Enfield Bullet 350 - Dream Bike,5,"I got my bullet  on may 20, 2020. Actually, my father had given it to me as a surprise. It was literally the bike of my dreams. I possess a 2020 BS4 bullet standard 350 model. Secondly, the riding experience is excellent. With my beast, I have explored all of the south Indian states. Additionally, because I worked in Bangalore, I utilised it to travel there. Excellent rider comfort and a pure riding experience. A himalayan back carrier has been introduced. My rear tyre was also updated to a mrf meteor 110/90 19. It is actually a very good tyre for turning, highway driving and off-roading. My bike is now more stable "
Royal Enfield Bullet 350,4.5,Good Bike In This Segment,5,"The 2022 Royal Enfield Classic 350's everyday practicality makes it appealing for a wide variety of uses. With friendly power delivery, neutral handling, and approachable ergonomics."
Royal Enfield Bullet 350,4.5,Good Performance,4,"The Royal Enfield Bullet 350 is an iconic motorcycle that has stood the test of time, capturing the hearts of riders across generations. We dive into the enduring charm and performance of this legendary machine."
Royal Enfield Bullet 350,4.5,Value For Money,4,The overall experience of the bike was good. Very comfortable to ride in traffic and on the highway. Getting a mileage of 30-35kmpl which is average. This is a value for money.
Royal Enfield Bullet 350,4.5,Classic Appearance,4,"Recently, my brother purchased a Royal Enfield Bullet 350, and I must admit, I'm impressed. The bike is really elegant and has a timeless, classic appearance. The bike's handling is solid and smooth, and its strong engine offers outstanding acceleration. The bike's brakes are dependable and robust. A comfortable ride is provided even on uneven roads thanks to the bike's comfy seat and strong suspension. The bike gets less mileage than some other motorcycles in its group, which is the sole drawback. The Royal Enfield Bullet 350 is an outstanding motorcycle that is ideal for extended journeys and for anybody searching for a vintage and fashionable bike."
Royal Enfield Bullet 350,4.5,Excellent Bike,4,"This is a very good bike for the new generation, it looks amazing and has a powerful engine which is good for city rides as well as highways. Overall, it is an excellent bike in this segment."
Royal Enfield Super Meteor 650,4.3,Super Meteor 650 is a super awesome bike,4,"Soon after the Royal Enfield Super Meteor 650 launch in the market, I booked my test drive with the nearest showroom. There was one week’s waiting. The test drive experience was thrilling and hassle-free. The Royal Enfield Super Meteor 650 is a super awesome bike with all the modern features, perfect ride quality, and seating. The fit and finish and the price range everything is good and excellent."
Royal Enfield Bullet 350,4.5,Amazing Experience As A Pillion,4,"Riding as a pillion on my boyfriend's Royal Enfield Bullet 350 has been a fantastic experience. The bike's classic appearance and strong construction convey nostalgia and charm. The engine's thundering sound is music to my ears, and the smooth acceleration gives me a sensation of power and freedom. Long journeys are made more pleasurable by the comfy seat and well-placed footrests, while the bike's solid handling inspires confidence. Whether cruising through picturesque scenery or negotiating crowded metropolitan streets, the Bullet 350 provides a real and unique riding experience that leaves me wanting more."
Royal Enfield Super Meteor 650,4.3,Excited to ride - Super Meteor 650,4,"I booked Royal Enfield Super Meteor 650 in astral blue color in tourer version at a price of 3.63lacs ex-showroom, and the waiting period is around two months and some days. The quality ride and the fun to drive Royal Enfield has been doubled by the 650cc engine. I’m excited to start my journey with Royal Enfield Super Meteor 650."
Royal Enfield Bullet 350,4.5,Best in Comfort,4,"I saw a lot of negative reviews, yes, of course, Royal Enfield has pros and cons but if u want the Royal Enfield to be like duke it's not possible this is classic that is streets what I am going to say is choose the bike according to your physical personality. Royal Enfiled need good care and maintenance it is not meant for the fast rides, the comfort is the main motto. So if you want your ride to be comfortable smooth then go for Royal Enfield it's one of the amazing bike for Indian roads and more features compared to Harley with less price. The company is there for more than 50 years and had set lots of record in riding and also world record in stunts so I am very happy to be a rider of Royal Enfield made like a gun."
Royal Enfield Bullet 350,4.5,Best bike.,5,It's a custom bike and I love it because of its look and its performance and also I like the mileage of it. 
Royal Enfield Bullet 350,4.5,Good Bike,5,Best in price. Good in handling . Easy to maintain.
Royal Enfield Bullet 350,4.5,Best Bike ,4,Nice bike with good mileage and a smooth driving. Felt better performance than other bikes.
Royal Enfield Bullet 350,4.5,Super Bike,4,Its a nice bike and just for 1.5 lacs which is worth. Very comfortable and loving. It's not too fast but it reaches 100 km/hr easily.
Royal Enfield Bullet 350,4.5,Great Bike.,4,"It’s my favourite bike looking so good, performance is better and its engine is much powerful for this budget and it has a classic look which gives it more stars. so overall it is so good bike for this budget. "
Royal Enfield Bullet 350,4.5,Best bike ,4,"
Its too good and the voice of bullet is nice "
Royal Enfield Bullet 350,4.5,Nice Bike,5,"Since I am using the BS4 RE for 1 year I've observed quite a few changes in the BS6 Engine which are quite convenient compared to BS4 such as the smoothness of clutch, stand and the major improvement is the alloy wheels which reduces a lot of weight compared to the traditional spoke wheels I would suggest to BS4 users to change those traditional spoke rims to alloy as it is very light in weight, main point to mention is about the clutch it is very smooth and convenient to use in the traffic compared to BS4 which is a bit hard and irritating in heavy traffic. BS4 is carburettor based engine whereas BS6 is Direct fuel injection which improved the mileage and efficiency in burning fuel. The reserve for BS4 engine is 2 litres and 4 for BS6. Another improvement is the always-on light, In BS4 it is turned ON whenever the bike is in ignition mode irrespective of the kill switch, whereas in BS6 the light will be turned off when the kill switch is in off."
Royal Enfield Bullet 350,4.5,I like Royal Enfield bike.,5,One of the best bike in India. sound of this bike is very good and this bike is a royal bike for everyone.
Royal Enfield Bullet 350,4.5,The Bike you can't ignore,4,"Royal Enfield, it's not just a name, it is a status symbol. The look, sound and aura are awesome. After riding this bike you will feel like the King of the World. "
Royal Enfield Bullet 350,4.5,Best in the segment.,5,"Its a beast bike and it is so so comfortable to ride and have fun I love it 3000, the bs6 model offers beautiful rim. The Royal Enfield is just wow."
Royal Enfield Bullet 350,4.5,Comfortable and Smooth,5,Bullet 350 is a standard model of Royal Enfield and it looks very beautiful. It is very comfortable and smooth to ride.
Royal Enfield Bullet 350,4.5,Awesome Bike with great features,4,Good performance... And handling is good.. best for long highway run... Vibrates at high speed.. overall good experience.. mileage is a bit low compared to other features... Cost is a bit in the range at this vary class. Specially BS4 and BS6 variants are just awesome with headlamps on at the day time makes ride safe and safety matters at Royal Enfield bikes... And yes safety is there are these types of bikes...
Royal Enfield Bullet 350,4.5,Bullet is Best,5,Best bike if you are looking for long journeys and for the daily city use. I just love Royal Enfield. The BS6 version comes with better mileage.
Royal Enfield Bullet 350,4.5,Nice Bike ,4,A perfect bike for Indian cities. Turning radius is high. Nice balance to handle and the transmission is smooth. It gives the feel of a king. 
Royal Enfield Bullet 350,4.5,I love this bike,5,This bike is just amazing it gives a perfect shape to your personality .this bike is the best bike in this range of bikes holds a powerful engine and metal body.
Royal Enfield Bullet 350,4.5,Best in the class.,5,This is the best bike in the world because of its build quality. 
Royal Enfield Bullet 350,4.5,Best in the segment.,5,"The bike is good and it helps in downshifts crank, vibration is less compared to classic models.  "
Royal Enfield Bullet 350,4.5,Powerful bike,5,This bike is highly recommended by me. The engine is really very powerful and the performance is satisfactory. The looks of the bike are simply great.
Royal Enfield Bullet 350,4.5,Performance  bike ,5,It is an awesome bike with the best performance engine.  
Royal Enfield Bullet 350,4.5,Best in the segment of 350cc within the affordable price tag.,4,Simply smooth and superb looks are just wow and eye-catchy. 
Royal Enfield Bullet 350,4.5,Performance&Power pack,5,"Royal Enfield 350 bullet is not just a bike it is the passion of nowadays youngsters and other bikes just give you power, mileage, etc but royal Enfield 350 bullet gives you respect."
Royal Enfield Bullet 350,4.5,GREAT BIKE.,5,"If you are a fan of Royal Enfield then only purchase this Motorbike. It is not a sports bike, but riding feel is good. it is good for Local ride, but the service of the bike is not good and also tapping sound is a big problem. It is better after the free service to do the service outside of a good technician. And these bikes need more maintenance compared to the others. These bikes are only for those people who are not crazy about speed and bike stunts."
Royal Enfield Bullet 350,4.5,Real power bike ,5,This bike has great power and it really looks like royal  and i think it is better than harrely Davidsons
Royal Enfield Bullet 350,4.5,Happy to be a Royal family member,5,"
"
Royal Enfield Bullet 350,4.5,Best bike ever.,5,"The Great bike with, amazing ride outstanding bike. The best company ever a very comfortable ride. The best bike in its segment. I choose Royal Enfield Classic 350 because of its elegant design, performance, engine thump and all above its royal."
Royal Enfield Bullet 350,4.5,Beautiful bike ,5,One of the most decent bikes ever made for regular work for travelling purposes also and all for long rides too..
Royal Enfield Bullet 350,4.5,Great to ride,5,I like this bike Because of its design and Superb performance. Best bike for offroading.  
Royal Enfield Bullet 350,4.5,Best in the class,5,"This bike is great in terms of the ride experience, it is the best bike in the segment."
Royal Enfield Bullet 350,4.5,Best bike ,5,Good engine and nice working performance its acceleration is awesome and its sound is very loud and stunning because when we accelerate it on the roads it is perfect for swing ride and also it is very good for High-speed ride. When I use it personally I recommend it to other professionals too and now I will also use it for long drives.
Royal Enfield Bullet 350,4.5,Dream Bike ,5,My dream bike this bike has an excellent engine and that sounds to make your heart pumps higher make life enjoyable..
Royal Enfield Bullet 350,4.5,Best bike ever.,5,The best bike in the segment.
Royal Enfield Bullet 350,4.5,I have top bike and so stylish... ,5,Royal Enfield bullet 350 is a good bike. Good engine power and Awesome looks.
Royal Enfield Bullet 350,4.5,Best in the segment.,5,"It was just an amazing bike with a great look, comfortable seating position and suitable for a long ride."
Royal Enfield Bullet 350,4.5,Good looking- Royal Enfield Bullet 350,5,Royal Enfield Bullet 350 is the best bike in the world.
Royal Enfield Bullet 350,4.5,Nice Bike - Royal Enfield Bullet 350,5,Royal Enfield Bullet 350 has great performance and mileage. Comfortable seating position and riding position. l love to ride Royal Enfield standard 350.
Royal Enfield Bullet 350,4.5,Nice Bike - Royal Enfield Bullet 350 ,4,Royal Enfield Bullet 350  gives a royal feel while driving.
