Varient_Name,Average_stars,Review_title,User_rating,Review_description
Royal Enfield Bullet 350,4.5,Robust Bike,4,it's a robust and royal...little heavy approx 190 kg...those who has any backbone problems font buy...
Royal Enfield Bullet 350,4.5,Great Bike,5,This bike is so easy to control both on and off the road!!
Royal Enfield Bullet 350,4.5,Bullet Electra UCE,5,"I have a 2014 model Bullet Electra. Till date I haven't faced any issue, and am very much happy for the overall performance the bull has delivered till date, sitting position is perfect, great for taller people. One issue that I observed is, sometimes (probably because of the front disc brake), the rider feels the rear wheel wobbling/slipping while riding on patchy roads."
Royal Enfield Bullet 350,4.5,Like a BULL,2,"First it was amazing,awesome,little heavy,good in drive and comfort,class but as 3-4 months passed away,it started creating problems. It needs every day care,even if a bolt is loose,you can hear bike creating little extra noise,not comfortable to drive,average is also not good.Its good for those peoples who want to drive it on sundays or other occasion,with their friends etc.Its not good for regular use,its engine and performance is good but you need to spend money every week to maintain its goodlooks and design.But i love its voice,it sounds crazzzzzzy,just loving it."
Royal Enfield Bullet 350,4.5,It feels like a king. ,5,Quite costly in maintenance but great comfort and gives you the retro and royal look. Buy this if you want to ride a bullet if not this then you can any another Royal Enfield product. 
Royal Enfield Bullet 350,4.5,Super bike,4,I'm satisfied on my bike. Heavy engine n chassis are give the best performance. The look of bike is very attractive and it is fit for indian road. Thank you
Royal Enfield Bullet 350,4.5,Bullet- powerful bike,3, 
Royal Enfield Bullet 350,4.5,its a good travelling bike.,4,"i have ride old and new bullet. both are good for travelling long distance. there is vibration problem. all the parts are avilable. it has a deceent milage. and milage depends on how we ride, if we ride properly then we will get 40 above milage."
Royal Enfield Bullet 350,4.5,Royal Enfield Bullet 350,4,I own STD 350 since Apr 2017 till the date I am very much satisfied with the bike performance. I want to tell you that this bike is not for those who ride at 100/kmph. Such guys should not go for this bike. 
Royal Enfield Bullet 350,4.5,Bullet best bike,3,Royal Enfield Bullet 350 is best bike you can own and i love riding it on long routes you don't need any one's companion  to ride this bike.
Royal Enfield Bullet 350,4.5,have some issues,3,I have an electra 2017 model .problem is bikes back suspension is got rusted is it posible to replace under warranty .
Royal Enfield Bullet 350,4.5,Lovethebike,5,"This is an amazing bike for a long ride, it looks more beautiful."
Royal Enfield Bullet 350,4.5,bike is best ,5,this bike is very best bike for a man . man like this bike 
Royal Enfield Bullet 350,4.5,Road king royal,5,"Very nice and powerful bike ,this bike very powerful and budget bike"
Royal Enfield Bullet 350,4.5,Legendary bike,5,Its my fav bike its shows the mens legendary
Royal Enfield Bullet 350,4.5,My Good BIke.,5,It is a good bike. I like this bike very much. I enjoy the ride also. It gives me great pleasure. I experienced many bikes but it is best of all which I have ever driven. It gives mileage is 45/kmpl & the condition is also very good It is very comfortable for riding.
Royal Enfield Bullet 350,4.5,My Review For Royal Enfield,4,First of all the standard look of Royal Enfield is cool & the seating posture is also good. it's not equipped with disk breaks. Milage is not bad compared to engine power. Fuel tank capacity is decent of 15 litres. The engine is 350cc. & designed for passion. Love Royal Enfield.
Royal Enfield Bullet 350,4.5,"Always a ""Tough guy's Taste."" ",5,"Perfect one for the vintage RE Bullet Standard lovers. Excellent old vintage thump, no vibrations of handle bar, seating comfort is best among other RE's. "
Royal Enfield Bullet 350,4.5,Sturdy Ride with Classis 350,4,To complete the dream of Royal Enfield at a low cost is comes true with 350 std. mine is a 2012 model. It’s a Sturdy bike with well ground grip. Easy to handle with good pick up & speed. Breaking is also good but has to modify for instant breaking. Need to provide self-start also. the overall bike is good & value for money.
Royal Enfield Bullet 350,4.5,Bullet lovers,5,"Loves to ride my bult (bullet) on a longer way. Always find time to ride the hulk on the roads of  Punjab, Delhi. My 2 longest rides from Delhi to Nepal, and Bangalore to Mumbai were awesome. Now planning to go on a ride to Leh Laddakh. Just need a small service to be done. And we are good to go on ride."
Royal Enfield Bullet 350,4.5,My Super Bike,5,"It has got looks, superb & excellence performance by a superb engine of 350. It was a dream come true to own a classic 350. It all started when My brother gave a chance to be his pillion way back in 1973 on his standard bullet. He touched 100 Kmph and slipped it into neutral. It cruised for about one and half km like a dream. I have hooked to it and I made a plan to own a Royal Enfield."
Royal Enfield Bullet 350,4.5,Bullet classic,5,"Mere pass choti tanki wala classic hai jo ab nahi aata,alloy wheels lage hai ,jo bike aur funky banate hai,aur chota tank classic ko aur classic banata hai"
Royal Enfield Bullet 350,4.5,The best bike,5,The best bike you feel so pride while riding for Long distance can travel without tiredness and gives you Good average.
Royal Enfield Bullet 350,4.5,The cyclone of the Royal Enfield,5,"The Royal Enfield bullet 350 is very awesome to ride! It's the coolest cruiser bike that can go in any toughest conditions! It has a very good suspension system! Its crank weight has been decreased and also the thing is that the new version has got a major change in gear system from right to left side, which made him like the same feeling as local bikes! Its price has got a little bit higher! It has a very good engine and valve! The Royal Enfield bullet 350 is the benchmark for the whole Royal Enfield family! My bike is Royal Enfield bullet 350 standard with abs! It's my 3rd bullet apart from the old bullet! I love the gear bullet very much! Very thanks to the Royal Enfield family and Great Britain for the wonderful bike! Nothing can stop the riding as the bullet can! "
Royal Enfield Bullet 350,4.5,Can do some more better,4,"Firstly in standard tires should be tubeless, the indicator should have sound, should give self start and the headlight should be LED and should give led guard with bullet installed from the company."
Royal Enfield Bullet 350,4.5,My experience,5,"Very comfortable, nice looking and dashing bike. Good for long drives and it gives you the best performance, not only this but the company which makes it for you according to me they follow the policy of service. Before self, not only this but also they help you in your design and accordingly they provide you there best services. I have an old model Bullet of 1990 and I proud to be a part of Royal Enfield family."
Royal Enfield Bullet 350,4.5,Basic Royal Enfield,4,"It should be renamed as Basic Royal Enfield , because now it's not on the mark up line and not meeting standards also of today's requirement like ABS and Self start ."
Royal Enfield Bullet 350,4.5,Awesome Bike Bullet 350 standard,5,Excellent bike Bullet 350 Standard. It gives you immense feeling while riding this Royal bike and I am so happy to have Royal Bullet.
Royal Enfield Bullet 350,4.5,A cultural bike of Punjab and India,5,"Royal Enfield Bullet 350 is a dream for most of the Indians. That's why it is so common in our society. It is not only a bike it is like a culture. There is in India at least 4 persons from 10, have this bike and other 6 also wants to buy this. The performance and look is also great. I love this bike and it is so nice. "
Royal Enfield Bullet 350,4.5,Standard 350 (New model-2019),5,Very Good and very comfortable for riding
Royal Enfield Bullet 350,4.5,Soulful MotorBike- Bullet 350,5,"Bullet 350 is a very good motorcycle for touring and normal city riding, it has a very good torque and it can cruise on 90kmph continuously without breaking a sweat."
Royal Enfield Bullet 350,4.5,My dream bike,5,"My overall experience with this bike is awesome. I choose this bike because it comes with a heavy-duty engine. But it comes with some issues like it's weight is heavy but there are many benefits of this beast, its a fully off too machine, mileage is normal with so comfortable seating position, great pickup on steep roads and after-sale service is good which costs around Rs. 2000 to 2500 maximum."
Royal Enfield Bullet 350,4.5,Royal ride,5,One of the best royal rides I have ever had before. I am pleased to have Royal Enfield Bullet 350 and want to have one more bike.
Royal Enfield Bullet 350,4.5,Bike for safety and comfort,5,Good looking.. best in the segment..
Royal Enfield Bullet 350,4.5,My First Love ,5,"Mountain biking isn’t a sport, an activity, a lifestyle or an adventure. It’s just an exercise in consumption. Reviews are more important than any other aspect of a media outlet’s portfolio."
Royal Enfield Bullet 350,4.5,Superb bike,5,Very nice bike with nice looks. The drive is very good and it is better as compare to other bikes.
Royal Enfield Bullet 350,4.5,Beast bike for ruling roads. ,5,"Just bought few weeks ago, absolutely loved it i feel zero vibrations on it btw im 105 kg man and bike perfectly suits me. Bike has really nice asthetics and performance even though I have more weight than average I still able get it to 100+ kmph. Overall engine sometimes lags in terms of initial pick up but overall bike is awesome. "
Royal Enfield Bullet 350,4.5,Excellent Power Performance,4,Excellent in performance due to its high capacity engine but mileage is a little bit less due to high power of the engine.
Royal Enfield Bullet 350,4.5,Boss Of All The Bikes: Royal Enfield Bullet 350,5,"The Bullet is the boss of all the bikes in India. And overall, very nice bike. It is not just a bike its Bullet."
Royal Enfield Bullet 350,4.5,Lovely Bike ,4,Great bike at its price. Especially the Royal Enfield brand name and it's sound is just fascinating. It lacks a petrol meter but does have a low petrol signal on it. Its long single seat is very comfortable and very good for family use. It has ABS plus disc brake at the front and drum in the back. My one is showing a great mileage of 45km/liter to 47km/liter in city conditions. Servicing cost is also not much. If you are thinking about it then just go for it. 
Royal Enfield Bullet 350,4.5,An Amazing Bike,5,It is an amazing bike at this price range. The mileage is good with great power. 
Royal Enfield Bullet 350,4.5,good economic bike,3,Everything about Royal Enfield Bullet 350 is good but the backside along with the number plate of these models is slightly bending either right or left.
Royal Enfield Bullet 350,4.5,Let your senses decide.,4,"From my personal experience so far, here's what I think: · Performance of the bike does not depend just on the new unit constructed engine, but also on the usage. If ridden within acceptable limits, the bike will exhibit a higher than perceived fuel efficiency. I get raised eyebrows from people when they hear my bike runs at 40–42 kmpl.· Although the bike is sufficiently engineered to serve both everyday commute and long rides, it is still not a perfect machine. There may be minor sporadic issues like blown lighting bulbs(parking, speedo) , braking switches going kaput, clutch cable snapping and some more. So far, I have not experienced any serious breakdown, while on the road. Bottom line is, if the vehicle gets its due attention and servicing, chances are rather slim that one would face issues.· Like many RE bikes, it does not have tubeless tyres, which obviously means, that a puncture on the road will certainly cause some distress. But then, if you ride with the correct tyre pressure, you may not have to see that day.· As mentioned earlier, one can do long stretches on it, and it is quite comfortable. Credits to the spring seat for that. For the pillion rider though, I cannot say the same. The stock pillion seat and a lack of backrests, are to blame. In one of my rides along with a friend who rode pillion, after 9 hours of riding, he utterly refused to ride back in the same fashion and took the overnight bus instead. May be, RE should think about the pillion rider too, and include a better pillion seat and a decent backrest.· Though it lacks features like a tachometer, a fuel gauge, which some consider standard in today's bikes, I personally did not feel the need. Absence of a fuel gauge will require you to do some math, and also be aware of fuel amount left. I am not sure if a tachometer will help in anything else, other than giving a clue on when to switch gears. If you intend to own one, then you must ride it once, get the feel of it, and let your senses to decide."
Royal Enfield Bullet 350,4.5,Nice economic bike,3,Everything of Royal Enfield Bullet 350 is good but the backside along with the number plate of these models is slightly bending either right or left. There is some rusting issues with the body of the bike but the overall performance of the bike is very good. and best of all is its seat which is very comfortable. 
Royal Enfield Bullet 350,4.5,Best Bike - Royal Enfield Bullet 350,5,"Royal Enfield is an awesome bike, it has good mileage. It has got a great sound. This bike is best for touring."
Royal Enfield Bullet 350,4.5,Best Bike ever - Royal Enfield Bullet 350,5,Royal Enfield Bullet 350 is the beast. This bike is amazing.
Royal Enfield Bullet 350,4.5,My Favourite Bike ,5,This bike is the best in terms of reliability and sustainability and there is no match for this bike.
Royal Enfield Bullet 350,4.5,Awesome Look Bike ,5,Really fantastic experience and now I will suggest others also to get the Royal Enfiled Bullet and all bullet series are fantastic to ride.
Royal Enfield Bullet 350,4.5,Awesome Experience of Bullet,5,"My bullet is fantastic and I have a very good experience riding it, it is also very nice and I would suggest this bike to others also to get a Bullet."
Royal Enfield Bullet 350,4.5,Best Performance - Royal Enfield Bullet 350,4,"Royal Enfield Bullet is a bike with a nice, comfortable and low maintenance! "
Royal Enfield Bullet 350,4.5,All are fans of bullet.,4,It's a wonderful bike by Royal Enfield. It has a very good exhaust system.
Royal Enfield Bullet 350,4.5,Smooth drive.,4,Excellent bike for a long-distance ride. It delivers the best performance for city riders.
Royal Enfield Bullet 350,4.5,Royal Enfield no one,5,"Excellent bike and its favourite, great performance. Its India's best motor cycle."
Royal Enfield Bullet 350,4.5,Quality Is Low.,2,"This bike is not made for fast speed. The material quality is low according to the price and brand. Moreover, it has high maintenance. The waiting list is long.  After the sales, there is no proper help given by sellers. They just want the money."
Royal Enfield Bullet 350,4.5,Best in the segment.,5,Very durable and dependable bike with a retro taste. It runs hassle-free and the parts are available easily.
Royal Enfield Bullet 350,4.5,You can feel the power.,5,This is not a bike it is a dream we don't ride it we feel it. This bike cannot be compared to others because it is a beast itself.
Royal Enfield Bullet 350,4.5,The comfortable bike.,5,"Royal Enfield classic 350 looks amazing and is very much powerful. Its performance is mind-blowing and delivers ultimate mileage of 35kmpl to 38kmpl. It's also, ideal for long journeys. Highly recommended."
Royal Enfield Bullet 350,4.5,Lovely bike.,5,Amazing bike for a royal person as it develops the personality of the rider.
Royal Enfield Bullet 350,4.5,The highway king.,5,Amazing speed and a wonderful performance so far.
Royal Enfield Bullet 350,4.5,Excellent bike.,5,Amazing cruiser bike.
Royal Enfield Bullet 350,4.5,Great looks.,5,A perfect bike so far as looks amazing and churns unbelievable performance.
Royal Enfield Bullet 350,4.5,Stylish bike.,5,Good bike for a comfortable journey. My next Bike also is Royal Enfield. This bike has stylish looks.
Royal Enfield Bullet 350,4.5,Required headlight bulb switch to turn is off.,5,"It is a very fantastic bike, runs smooth and has a simple function. However, there has to be a slight change wherein a headlight switch should be given to turn it off or on. "
Royal Enfield Bullet 350,4.5,Value for money.,5,"Best bike in this range and also a Vale for money bike and I recommend to everyone. The bike has a very comfortable riding posture, the engine of bikes is best in this class."
Royal Enfield Bullet 350,4.5,best bike.,5,The bullet is the best bike for riding and when we ride it we look like any king is coming to and its silencer is amazing.
Royal Enfield Bullet 350,4.5,Good Bike ,5,This bike is very good this bike look like a dadu and I was very happy after taking delivery of this bike Royal Enfield Bullet 350 this bike is very generous this is cruiser bike this bike is best I love this bike
Royal Enfield Bullet 350,4.5,Best Bike ,5,The best bike I got I love to drive royal Enfield it is very good I love the way we can modify the bike in our own way 
Royal Enfield Bullet 350,4.5,Wonderful Bike.,5,"Really, I am enjoying the bike. Once we drive this bike, can not think about the other one. Its color and design both are ultimate. Highly recommended."
Royal Enfield Bullet 350,4.5,Best bike ever.,5,Awesome bike with a comfortable seat for a long tour and has an awesome braking system. 
Royal Enfield Bullet 350,4.5,Best Bike ,5,"I have 350 Electra and it never disappointed me in terms of comfort & mileage no matter what the ride is short or long. Its efficient and spacious is too good, I would and have been always recommended Enfield 350 to my friends."
Royal Enfield Bullet 350,4.5,Beast bike.,5,"Awesome bike to ride and has an excellent riding comfort, the bike is best to ride on highways."
Royal Enfield Bullet 350,4.5,Excellent bike.,5,Royal Enfield is a very good product to use and buy and it is a very good bike. Packed with safety and other features and it is value for money. I am using this vehicle and I am very satisfied and I recommend this bike to all those who want to enjoy the royal ride because when you ride on this bike you will feel your self royal and unique identity.
Royal Enfield Bullet 350,4.5,Best in the segment.,4,"This is the best bike in the 350cc segment, the ride comfort of the bike is amazing. The maintenance cost of the bike is average, it is perfect for long rides as well."
Royal Enfield Bullet 350,4.5,Great bike.,4,"I bought it on 31 March 2019. Without a Disc brake, after 4000 km It is really amazing as a new performing bike. Heavy body with a muscular look. Sitting pose is best at all. The only cons are in this bike is Front braking because drum brakes has not enough power."
Royal Enfield Bullet 350,4.5,Amazing bike .,5,"Excellent bike. Once you own it, you'll never like another bike. The craze that comes with it is amazing and the feeling to ride a bullet is magnificent. "
Royal Enfield Bullet 350,4.5,Best in segment,4,This bike is perfect for long rides and mileage is also awesome. I think brakes are also soo good on this bike.
Royal Enfield Bullet 350,4.5,Awesome bike.,4,The handling on the bike is great along with good torque.
Royal Enfield Bullet 350,4.5,Excellent Bike with great Features,5,"It is a good bike of course better than 150CC bikes, after using the RE other bikes feel like toys. The only issue is the poor quality of ignition and light switches. Have been using it for more than 3yrs. Service quality has improved, since 2019 in Secunderabad service centre. The battery cover rusted within a few months. Lets, what all issues crop up in future. I feel proper and decent usage and maintenance will help in the long run for the owners. Carelessness will damage any bike for that matter."
Royal Enfield Bullet 350,4.5,Excellent bike in the segment.,4,"As we say the Royal Enfield is the motor that gave the spirit of riding in India a body, It bought it to life. If a person who knows about how bikes and riding in India changed from generation to generation would surely know that the Enfields are a piece of art through all the generations. "
Royal Enfield Bullet 350,4.5,Nice Bike,5,"Its a nice bike, comfortable while riding and also gives royal looks. "
Royal Enfield Bullet 350,4.5,Satisfactory purchase,3,"The paint job is great, along with the ride quality, the brakes are a bit dull."
Royal Enfield Bullet 350,4.5,Great bike,5,The bike is very strong and toughly built. The bike has great power output too. It looks stunning.
Royal Enfield Bullet 350,4.5,Excellent Bike with great Features,5,"I saw a lot of negative reviews above yes, of course, Royal Enfield to has pros and cons, but if you want the Royal Enfield to be like duke it's not possible this is classic that is streets what I am going to say is choose the bike according to you are physical personality Royal Enfiled needs good care and maintenance. It is not meant for the fast ride the comfort its the main motto, so if you want your ride to be comfortable smooth then go for Royal Enfield. It is one of the amazing bikes for Indian roads and more features compared to Harley with less price. The company is there for more than 50 years and had set lots of record in riding and also world record in stunts so, I am very happy to be a rider of Royal Enfield made like a gun."
Royal Enfield Bullet 350,4.5,Best bike,5,"The bike has trendy looks and the performance output is great, the design is awesome too."
Royal Enfield Bullet 350,4.5,Best Bike ,4,Bike is perfect but braking system is so weak and also the vibrations in the bike.  
Royal Enfield Bullet 350,4.5,Excellent Bike.,4,It is an excellent bike with a great and powerful engine. Looks are also very royal.
Royal Enfield Bullet 350,4.5,Awesome Bike with great Features,5,"For long drive very useful I love very much excellent, wonderful, marvellous, what I expected I got in this bike. "
Royal Enfield Super Meteor 650,4.3,Super Meteor 650 good bike,4,A new motorbike from Royal Enfield that is highly stylish and modern-looking is about to be released and is expected to draw plenty of attention. I'm eagerly anticipating the debut and can't wait to have one. probably make a reservation on the first day.
Royal Enfield Bullet 350,4.5,Very good ,4,Very good and my best price best bike  
Royal Enfield Bullet 350,4.5,The Sound is enough,5,"This is one of the motorcycles, which doesn't need to be seen for its presence, the sound of the bike is enough.  Born from a rich heritage and legacy of Royal Enfield with 350 CC of the engine. "
Royal Enfield Bullet 350,4.5,Royal Bike,5,Super bike 
Royal Enfield Super Meteor 650,4.3,Best Design - Super Meteor 650,5,"Royal Enfield Super Meteor 650 is a stunning bike. Due to the appearance, which also look luxurious, this bike has the best design in its category and reasonable costs."
Royal Enfield Super Meteor 650,4.3,Best Design,4,"The Super Meteor's design is imposing, proportional, and sumptuous, to use a few descriptors. In traditional cruiser form, it has a large wheelbase, yet it doesn't appear too stretched. In actuality, it's a fantastic fusion of vintage components, including a round headlight and a fuel tank shaped like a teardrop, with a touch of modernity provided by blacked-out alloy wheels and the engine case."
Royal Enfield Super Meteor 650,4.3,Royal Bike,4,Very good experience. Must have to be with Enfield safety and its features are amazing. Look wise it is properly muscular and less maintenance. I am confused till now that which one should I have to be but after taking a test ride of Royal Enfield feeling royal and I am very sure that this is the one which I have to be.
Royal Enfield Super Meteor 650,4.3,About The Journey Of The Meteor 650,4,The bike super meteor 650 is the best bike I had ever ridden in my life till now. The smoothness of the bike and the grip of the tire on the road is awesome. The mileage is good. It has awesome performance with a super powerful machine with 650 cc.
Royal Enfield Super Meteor 650,4.3,Experience power and effortlessness,4,"Experience power and effortlessness with the Royal Enfield Super Meteor 650. This elite presentation cruiser joins exemplary styling with current designing. With its strong 650cc motor, high level suspension, and responsive taking care of, the Super Meteor 650 conveys an elating and refined riding experience. Whether it's the instructing presence, smooth power conveyance, or the immortal plan, the Super Meteor 650 allows you to encounter the ideal mix of force and tastefulness out and about."
Royal Enfield Super Meteor 650,4.3,strong candidate those looking for a cruiser bike,4,"One of my all-time favourite cruiser bikes is the Royal Enfield Super Meteor 650, without a doubt. It has a traditional style, and modern facilities, and is reasonably priced. The bike is a delight to ride since it performs on the road with strength and grace. Everywhere it goes, the Super Meteor 650 draws attention because of its air of sophistication and elegance. It is the ideal travel partner for long, leisurely drives because of its comfortable sitting position and superb handling. The Royal Enfield Super Meteor 650 is a strong candidate for anybody looking for a cruiser bike with excellent value."
