Varient_Name,Average_stars,Review_title,User_rating,Review_description
Honda Activa 6G,4.3,Best Scooter,5,Activa is the best Scooter from the Honda brand.  I am feeling great after buying this.
Honda Activa 6G,4.3,New Honda Activa 6G,5,Honda Activa 6G will be the best scooter for all due to its new latest features and powerful mileage. 
Honda Activa 6G,4.3,Good ATV6G,5,"India is the best scooter, Honda Activa super scooter I like you good vehicles so powerful engine super."
Honda Activa 6G,4.3,Honda Activa 5G,5,Excellent Scotty from the Honda easy to handle and good for daily commuting I like this very much.
Honda Activa 6G,4.3,Good App must be downloaded And Share,5,Very nice App must be download. It tells us everything about moto vehicles.
Honda Activa 6G,4.3,Honda Activa ,5,Activa best scooter with powerful engine India's best scooter and very easy to handle.
Honda Activa 6G,4.3,Honda Activa BS-VI Features,2,"Full digital meter not available, feature like Eco drive indicator, digital speadometer, digital fuel and oil indicator, average monitor not present in digital meter, head lamp light should be improved to 16 V, back light led not present, front smart phone mobile holder not present, seat length not increased, mileage not increased, looks very compack, ignition switch should be there, engine on eco mode while standing on red light feature, no modern feature pre except fuel injection added, ABS control anti sket/slip technology not used, rear telescopic suspension for back relief during long drive not present, modern features should be added to give new look not retro ancient look."
Honda Activa 6G,4.3,Honda Activa 6G review,5,Nice scooter with a powerful engine and tubeless tyres and will be available in the market by the month of October 2019 With good features. The seller said that it will be available near Diwali occasion and its  price would be around  75000 rupees with exciting offers and great deals so that the buyer does not get any problem when buying the 6G Activa
Honda Activa 6G,4.3,Super bike in Activa 6G ,5,Honda Activa 6G bike is super and amazing with superb mileage and super speed and easy to handle.
Honda Activa 6G,4.3,Family scooter,5,It is suitable for all age's of family numbers. Stylish and safety. It is improve our dignity.SoI like Honda activated 6G
Honda Activa 6G,4.3,Superb scooter.,5,"Activa 5G is a superb model ever made by Honda, I think that honda will add some great features in 6G model."
Honda Activa 6G,4.3,Best scooty in the world ,5,It's so nice scooter. It is so comfortable to ride. This is very useful our all family members can use this scooter for their work. I go to school every day with this scooter and its giving so nice performance. My friends are also shocked by seeing the features of this scooter. So that's why it is my favourite scooty.
Honda Activa 6G,4.3,Costly bike,4,"Good one but too costly after accessory, and every thing it costs 82000 too costly if i can spent 80000 to Activa then go for a bike."
Honda Activa 6G,4.3,Good hdhsksklsnb,5,Honda Activa has a good pickup even in the winter season. Nice Scooter.
Honda Activa 6G,4.3,Improvement required.,3,"Two things are most important for improvement, mileage, and top of handle flap it always makes a sound. "
Honda Activa 6G,4.3,Great Bike.,4,"Nice good looking bike and bigger than the previous model and have good telescopic suspension, new look and fuel lid at the back LED lights to add a new feature."
Honda Activa 6G,4.3,Awesome scooter.,5,"Honda Activa 6G has a great mileage scooter, and this more expensive and attractive scooter Honda Activa 6G."
Honda Activa 6G,4.3,Great Scooter.,5,"Value for money as expected from Honda, great performance with sleek design and mileage.Excellent vehicle for family"
Honda Activa 6G,4.3,Super Bike,5,An excellent bike I am very proud to say enjoy this scooter. Good mileage nice look in scooter Honda Activa is the best in its segment.
Honda Activa 6G,4.3,Awesome Scooter.,5,"Amazing look along with silent start makes it one of the best scooter, Its stylish look is also worth it."
Honda Activa 6G,4.3,Wonderful Scooter,4,"Nice and beautiful scooter with wonderful mileage and full safety and secure thank you, Honda."
Honda Activa 6G,4.3,Great Scooter.,4,"Very good handling, comfort, good mileage and another good thing is the company has changed the front jumper so no more heavy jerks and feels like a premium scooter and good for senior citizens too they can easily go anywhere with no tension for jerks and backpain, surgery patients can also ride this scooter."
Honda Activa 6G,4.3,Great Bike.,4,Honda Activa design is best and provided by chrome and led headlamps and fuel injection engine.
Honda Activa 6G,4.3,Super Scooter.,5,"Excellent price, excellent mileage, super performance, great bike."
Honda Activa 6G,4.3,Nice Bike,4,"Nice scooter and comfort, the petrol cap is very nice."
Honda Activa 6G,4.3,Very Nice Scooter,5,"It's a very nice Activa model and very good looking, nice smooth running and the engine sound is very low, the superb suspension system is totally amazing. I loved this Scooter so much, comfortable while riding and had very nice handling and too much enjoyed when riding, really great model. I loved its headlamp, back and front both, overall the scooter has very fewer changes from the old model design of the engine and headlamp, but the scooter is totally great."
Honda Activa 6G,4.3,Good Bike.,5,This scooter is very nice comfortable also the braking system of the bike is good.
Honda Activa 6G,4.3,Amazing Bike,5,I'm really impressed with this scooter. It's got some serious speed and overall it's an amazing bike.
Honda Activa 6G,4.3,Nice Vehicle.,4,Very nice and has better suspension than 5g which is quite easier to ride.
Honda Activa 6G,4.3,Nice Bike,4,"it is the best scooter, it can beat Jupiter. Its mileage is also more than others. There is an English colour of the scooter which are different from the other bikes different variants. Also, its engine is powerful."
Honda Activa 6G,4.3,Nice Bike,5,It is an awesome scooter. All things packed into one. I like the engine quality. Mileage is good.
Honda Activa 6G,4.3,Best Bike,5,The bike is so efficient for its setting position.
Honda Activa 6G,4.3,Awesome and Incredible Bike,5,"Honda Activa was launched in the year 2000. I had the first bike in Nallasopara west, it had really amazing features and incredible pickup power, I love Honda Activa bike because of its safety standard."
Honda Activa 6G,4.3,Ultimate scooter with power packed features in this range,5,"Decent scooter with updated looks. I am surprised by its silent start technology and improved mileage, it is giving 59 kmpl mileage."
Honda Activa 6G,4.3,Nice ,4,Decent  & safe scooter with gorgeous look. I am surprised by its silent start technology and improved mileage.
Honda Activa 6G,4.3,Best Bike,5,Nice scooter ever. I like the feature in this scooter that is it's on/ off switch button and external cap.
Honda Activa 6G,4.3,Activa lover,4,Activa is amazing bike. All new features are available that are very useful. I feel royal while riding Activa.
Honda Activa 6G,4.3,Best in the class.,4,Best Scooter Activa 6G comes with a great fuel economy and the power of the scooter is also great. The scooter offers a great styling and performance as well. 
Honda Activa 6G,4.3,Budget friendly and economical bike,4,"Budget-friendly bike for young and old people with great mileage, performance, and style to travel and avoid traffic"
Honda Activa 6G,4.3,Great in power.,5,The torque and the engine refinement is awesome in this scooter and great braking. 
Honda Activa 6G,4.3,Best in the class.,4,Best scooter under 80k best performance and specialty LED front led light is phenomenal and the suspension is good.
Honda Activa 6G,4.3,Mastt riding experience.good look,4,The Honda Activa 6G is am awesome scooter for the best riding experience.
Honda Activa 6G,4.3,Great bike,5,"This is an awesome scooter with new features like led lights, silent start. The vehicle has nice pickup and mileage and sports a telescopic suspension."
Honda Activa 6G,4.3,Best bike,5,"This is the most comfortable Activa we've ridden in a while and the upgrade was a long-desired one on the scooter. We also like that this is a better handling scooter than it used to be. It's a lot more confidence-inspiring at high speeds, and high-speed stability itself is much better than the older version."
Honda Activa 6G,4.3,Best scooter,5,"This is the best scooter in the segment and the scooter runs silently while driving, it has nice mileage output."
Honda Activa 6G,4.3,Nice Scooter ,5,"It's a nice scooter, gives great performance and it has been upgraded. Now it comes with new looks and features."
Honda Activa 6G,4.3,Good Performance ,4,This scooter gives a good performance and has good features.
Honda Activa 6G,4.3,Good Scooter ,4,"It is a good scooter, powerful and gives great mileage. "
Honda Activa 6G,4.3,Excellent Scooter ,5,"Its an excellent scooter, gives good mileage.                                           "
Honda Activa 6G,4.3,Nice Scooter ,4,"Its is a very comfortable scooter, pick up is also good. "
Honda Activa 6G,4.3,Best Scooter ,5,"Very impressive scooter, it has the best suspension and gives great performance in city. Best in this segment. "
Honda Activa 6G,4.3,Best Scooter In India,5,Most selling scooter in India.
Honda Activa 6G,4.3,Awesome Bike,5,When I was 13 it was my dream to ride a scooter now I'm 20. I bought this scooter Honda Activa 6G and I am really happy to get this scooter. It is very smooth to drive.
Honda Activa 6G,4.3,Best Scooter,4,Best scooter in the segment and it is comfortable and has stylish looks. 
Honda Activa 6G,4.3,Best Scooter,5,Good and comfortable ride. Good looking led light good and start sounds also good colour collection is Good
Honda Activa 6G,4.3,Best scooter,3,Need to improve features atleast on upcoming 7g 
Honda Activa 6G,4.3,Amazing Techologhy,3,I like its design and its technology is amazing. The bike is very comfortable and it can run on the road very smooth.
Honda Activa 6G,4.3,Best Scooter,5,I am using Activa 6G and I can say that its a best scooter for daily commuting with comfort and balancing. Its smooth driving makes it the best scooter. The new BS6 engine delivers more mileage than before. But the presence of USB charging port or boot light could make it more convenient.
Honda Activa 6G,4.3,Good Bike With Great Features,4,"This bike is just perfect for daily routine and for a short drive as well. Very comfortable and very smooth in driving, good mileage, perfect balance while driving, simple and formal look. And, the most important is that, perfect for females. Good braking and perfect acceleration."
Honda Activa 6G,4.3,Good Comfortable Scooter,5,Activa is one of the most top-selling scooters in India. It's a very good and comfortable family scooter. Everyone likes this scooter.
Honda Activa 6G,4.3,Very Good Scooter...,5,"Very good scooter. Its throttle response is very good. And, it’s good to handling. I am happy with this scooter."
Honda Activa 6G,4.3,Good Scooter,3,"It's a famous scooter from the starting but precious variants were better than this. Because of its alloys, it's styling totally changes because totally copied from active 125."
Honda Activa 6G,4.3,King Of Scooter Segment,5,Best scooter and everything is just perfect with low maintenance and good mileage and good for everyone best for family.
Honda Activa 6G,4.3,Good Scooty - Activa 6G,3,"I'm not fully satisfied with this bike but mileage is very super. It has a fuel tank of 5.3 L. It has very comfort. A balanced vehicle. Overall, I'm very happy with this bike."
Honda Activa 6G,4.3,Awesome Looks and Great performance With Amazing Metal Body,4,"The new Honda Activa 6G gets subtle changes over the older model... The all-metal body shell looks identical but you get a new front fender and twin slats with chrome accents on the front apron. The side panels now have a single air intake instead of two, as seen on the outgoing Activa 5G. The headlamp cluster remains the same, but the LED light is now restricted to the range-topping deluxe variant, as opposed to the 5G that received the LED unit as standard on all variants. The scooter also gets an elongated tail section and a revised design for the grab rail, bringing in a refreshed look."
Honda Activa 6G,4.3,Good Scooter ,3,"It's a good scooter, gives great mileage and comes with excellent suspension. "
Honda Activa 6G,4.3,Amazing Bike,5,I like its pick up with speed mileage and I am a fan of its braking and build quality. The solid metal used to make it and many more features thank you.
Honda Activa 6G,4.3,Stylish Beautiful And Looking Good,5,Nice and comfortable digit start. Easy seat opener and easy petrol block nice to sit inside.
Honda Activa 6G,4.3,Awesome Product By Honda,4,Awesome product By Honda from past years.
Honda Activa 6G,4.3,Best Bike In This Segment,5,Best Activa 6G and very comfortable scooter. The average is also very good and all the features are nice.
Honda Activa 6G,4.3,"Must Buy Product, Superb Product, Value for Money Product",4,Performance:-
Honda Activa 6G,4.3,Good Vehicle With Good Mileage,5,"Good mileage and good safety. Overall, mileage needs to be increased somewhat as everything is good."
Honda Activa 6G,4.3,Good Family scooter,5,"Good Family scooter. With improved engine and style. Easy to ride, easy to handle in heavy traffic. "
Honda Activa 6G,4.3,Honda Activa 6G- Awesome Comfortability ,4,My experience with Honda Activa 6G is totally amazing. If I talk about my personal feelings. It has fabulous comfortability with advanced technology which is enough to make your trip or journey remainder.
Honda Activa 6G,4.3,Activa Has Mileage Problem,4,"I have bought Honda Activa 5G bs4 in Sep it completed 1 year today. My last 3 free services I have done but still, my mileage does not increase. My Activa's mileage is around 30kmpl. I am not satisfied with this mileage. I am having RE Classic 350 its Mileage around 40 kmpl which is completely satisfied but the topic is now the Honda Activa 6G has come to the company say 60 kmpl don't know what is the real mileage please go for Suzuki Access125 nice sooty with good mileage."
Honda Activa 6G,4.3,Single strategy no advanced features,3,"No advanced features are available even after decades of its release. Honda is still sticking on to its only strategy of the smooth engine. When other scooter companies are providing features like external fuel filling, USB charging, 12-14 inch wheels, Bluetooth connectivity. Etc. Honda Activa does not have even a single feature of this kind. Prices are too high keeping in mind all the features. "
Honda Activa 6G,4.3,Superb scooty and wonderful performance.,5,"Superb scooty and marvelous performance, as expected in Activa 6g. Honda company made a lot of changes go groom, and enjoy the ride."
Honda Activa 6G,4.3,Activa 6G Performance Is Good,5,It was a nice experience. Activa 6G model of Honda is very excellent. Starting noise is very less compared to other scooters. External fuel system facility is good.
Honda Activa 6G,4.3,Excellent Mileage,5,"Excellent mileage active offer is outstanding, using this scooter for the last 5 years, and never got any problems."
Honda Activa 6G,4.3,A Dependable Two-wheeler,4,"The Honda Activa 6G caught my attention, but I have to say that I wasn't very taken with how it looked. I do recognize that it is a scooter with a price range of Rs. 77,287 to Rs. 83,288, making it a cost-effective option for anyone looking for a dependable two-wheeler. There are variations available to meet various preferences, with 3 types and 6 colours. The 109.51 cc bs6-2.0 engine of the Activa 6G provides enough performance for city commuting. The Activa 6G can be a sensible choice for you if you place a higher value on practicality than appearances."
Honda Activa 6G,4.3,Amazing Vehicle,4,"Honda Activa 6G was recently bought by my sister, and she loves it! This scooter has the newest technology and all these excellent features. The performance is completely amazing and the ride is safe and relaxing. She tells me it's been a great experience all around. She could not be happier with her purchase of the Activa 6G, which seemed to check all the correct boxes for her. I think if you are thinking of buying a scooter then you must think of Honda Activa 6G as it is a good option available."
Honda Activa 6G,4.3,The Bike Looks So Cool So Comfortable,4,"The bike has a stylish and appealing appearance, providing comfort for both students and families. Its affordable mileage is a notable feature as well."
Honda Activa 6G,4.3,Most Consistent Scooter,4,"I previously owned the old model of Activa, perhaps the first one. Now, I have upgraded to the new model, and it has not disappointed me at all. I am really happy with this purchase."
Honda Activa 6G,4.3,Good Performance,4,"The bike delivers good performance and has reasonable maintenance costs, making it suitable for city riders. The city average is also noteworthy."
Honda Shine,4.0,Superb Bike,4,"The bike offers a nice blend of good average, strong performance, and low maintenance costs, along with high safety features."
Honda Shine,4.0,Stylish Bike,4,"The Shine bike is impressive with its low maintenance and stylish design, offering comfortable riding. It performs well on long routes and is a great choice for those seeking good performance."
Honda Shine,4.0,Good Comfort,4,"This bike is very comfortable, and the refined engine is powerful. It has the best mileage in this segment and is the highest-selling bike."
Honda Shine,4.0,Best Performance,4,"I bought from delhi show room effortlessly . I just reserved the scooty and am getting the 24 hour conveyance with simple documentation process, I'm driving from last 5-6 years. I It has a la mode look when contrasted with others in this cost range. Discussing the presentation it is much better than others as all of us have in excess of 9 vehicles. It's smooth, simple to catch movement. This is a low upkeep scooty. Simply normal assistance and oil changing will run scooty without a hitch. Principal geniuses is smooth, for youthful and oid age."
Honda Shine,4.0,My experience with Honda Shine,4,"My experience with Honda Shine is that it is a popular commuter motorcycle known for its reliability, fuel efficiency, and comfortable riding experience. Its sleek design, smooth engine performance, and decent mileage make it a preferred choice for daily commuting. However, some users might find its power output and features relatively basic compared to other models in the same segment. Overall, the Honda Shine is a solid option for those seeking a dependable and economical ride for their daily transportation needs."
Honda Shine,4.0,A great Companion On Road,4,"The Honda Shine is something I've been using for a while. The bike is a delight to ride and handle because it is so comfy. Ample power and excellent fuel efficiency are provided by the engine's remarkable performance. The style is contemporary and elegant. Even during abrupt stops, the braking mechanism guarantees safety. The Honda Shine is a great option for both short journeys and daily commuting because of its durable construction and minimal maintenance expenses. I am quite pleased with its performance all around, and I would strongly advise it to other riders."
Honda Shine,4.0,Best Drive,4,"Initially, I thought that it might lack power due to its 125 cc engine. However, when I actually rode the bike, I was pleasantly surprised by how excited I felt while driving. It performs very well on the road."
Honda Activa 6G,4.3,Premium scooty ,4,"The Activa 6G provides a comfortable and pleasant riding experience. It is equipped with a smooth and refined engine that offers sufficient power for urban commuting. The bike's suspension system absorbs minor bumps and road imperfections, ensuring a comfortable ride. The Activa 6G is recognized for its stability and easy handling, making it suitable for riders with varying skill levels. The seat is well-padded and spacious, allowing for a comfortable seating position. The bike's lightweight nature also contributes to its manoeuvrability in traffic."
Honda Shine,4.0,Dependable And Economical,4,"The Honda Shine belongs to my uncle, who is thrilled to drive it for everyday commuting. It is a dependable and economical motorcycle that is ideal for regular commutes. It guarantees secure and quick braking with Drum front and Drum rear brakes. The Shine is a lightweight, fuel-efficient motorcycle that weighs only 99 kg and has a 9-liter gasoline tank, making it perfect for city riding. The Honda Shine can be the ideal bike for your everyday commute if you need something reliable and useful. I highly recommend it."
Honda Activa 6G,4.3,Very Beautiful,4,"This vehicle is very comfortable and comes in a nice color. It also has good mileage and a long seat for added comfort. Additionally, it is a safe vehicle."
Honda Activa 6G,4.3,A Scooter With Impressive Mileage,4,"As a Honda Activa 6G owner, I can verify that it is a dependable and beneficial scooter that excels in gas efficiency and affords a clean ride. The scooter is made to be economical, imparting exquisite mileage that lowers gas expenses.  The engine accelerates smoothly and has enough energy. It has a complete-face helmet well suited underneath-seat garage place in addition to a big virtual-analog instrument cluster and LED headlamp. However, key modern-day capabilities covered in other rival devices, such as Bluetooth connectivity and a USB charging connector, are absent from this model."
Honda Activa 6G,4.3,Trustworthy Vehicle,4,Honda is a trustworthy name for ages and I'm satisfied with my Activa DLX. This model is ₹2700 more expensive compared to the base model (Activa STD). The only difference is that it has LED lights compared to the age-old halogen light in STD. One upgrade needed in the upcoming models is a digital speedometer which is already present in Activa 125.
Honda Shine 100,4.4,Best One from Honda,4,The Shine 100 has dual shocks in the back and telescopic forks up front to make things easy. Drum brakes fitted on the five-spoke alloy wheels with road-biased tyres are used to brake the vehicle at both ends.
Honda Activa 6G,4.3,Practical Scooter For Regular Journeys,3,"My friend offered me a ride to school in his Honda Activa 6G, and it was enjoyable. The scooter surprised me by being fairly comfortable and delightful to ride, despite my initial concerns about how it looked. It has Drum brakes on the front and Drum brakes on the back, providing sufficient stopping power for safe riding. The Activa 6G is an ideal vehicle for daily travel since it is lightweight and fuel-efficient, weighing only 106 kg and having a gasoline tank size of 5.3 L. The Honda Activa 6G can be a fantastic option if you require a durable and practical scooter for regular journeys."
Honda Activa 6G,4.3,Comfortable Vehicle,5,"Honda Activa 6G is very comfortable, very good, and very easy to drive. Activa is very smooth."
Honda Activa 6G,4.3,Comfortable Scooter,3,I have been using Activa for 12 years. It's a very comfortable scooter that all my family members like. Anyone can easily drive it.
Honda Shine 100,4.4,Good Commuter,5,"This bike has numerous benefits for daily commuting. it's good for the middle-class family and maintenance cost is affordable. Overall, this is a good commuter."
Honda Shine 100,4.4,Nice Bik.,5,Good bike and the best price in this category nice look and nice good performance and nice handling and seating.
Honda Shine 100,4.4,Honda Shine 100: The Ideal Commuter Bike,4,"Firstly, I have shortlisted this bike because of its impressive features and specifications. The Honda Shine 100 comes with a 100cc BS6-compliant engine that offers a good balance of power and fuel efficiency. The bike has a sleek and modern design with a comfortable seating position, making it suitable for both city commuting and highway rides."
Honda Shine 100,4.4,New Shine 100 is more reliable,5,"The Honda Shine 100 is a reliable and fuel-efficient commuter bike that is perfect for daily use. It has a smooth ride, comfortable seating position, and low maintenance costs. However, the bike's design could be more modern, and it lacks some features compared to its competitors."
Honda Shine 100,4.4,Top notch commuter bike,5,"The brand-new Honda Shine 100 is a top-notch commuter bike with a comfortable ride, high fuel economy, and low maintenance requirements. The bike now has a five-speed gearbox and an engine stop-start system, and its updated appearance lends it a more contemporary feel. For anyone searching for a dependable and useful commuter, highly recommended."
Honda Shine 100,4.4,Great Bike,5,It looks nice and has such a great performance and such great mileage and looks are soo good great vehicle for the City area.
Honda Shine 100,4.4,THIS IS THE REAL HAPPINESS OF MIDDILE CLASS LIFE ,5,Very good vehicle and super in mileage we can travel with lots of fun and engine performance is very good as compared to other company vehicles and the refinement is extremely superb.
Honda Shine 100,4.4,Low maintenance Bike,5,"The Honda Shine 100 is a dependable, fuel-efficient, and low-maintenance commuter bike that offers exceptional value for the money. It is a well-liked option among daily commuters because to its straightforward design and smooth ride."
Honda Shine 100,4.4,Affordable Bike,5,"It comes with an affordable price and has good mileage with an amazing pickup. It is good for the daily commute, the maintenance cost is also low. I am happy to buy this bike."
